"comment","harmful_label","score"
"Your suffering is there profit. Im a business owner and I can tell you the mindset becomes thats what you cost the company. They get use to paying you that amount and they dont want to pay more. If you ask management to pay you 18k more they will never do it. Why? You cost them 64k a year. To them its practically set in stone. I wouldnt waste time with the discrimination route unless you have a stellar legal case. You know you deserve more so quietly find a new job that pays more and exit stage left. You owe them nothing.","neutral","0.6521519422531128"
"In reality theyre both the finance bro. The tech nerd stereotype hasnt been true since people realized how well tech pays and it was no longer people only doing it for the passion.","realization","0.8359258770942688"
"Three things I know. Harlan is good luck. Harlan is the best in the business and this game PISSES ME THE FUCK OFF. THIS IS A 1-6 JUGGERNAUT OF A TEAM.","anger","0.41009318828582764"
"While in culinary school a chef instructor from New England told us a story that a bowl of lobster stew meant for servants was accidentally served to the Rockefeller family, who enjoyed it so much that it became a permanent fixture on the menu. Who knows if its true","confusion","0.6833527684211731"
"Go back to your first straw man sentence in your 7-paragraph long pity party. What am I supposed to do. be a dingus?. Like, no. Nobody wants you to do anything. Except quit crying about how unfair were being towards you by saying America has gone Nazi when 1,200 people are missing.","annoyance","0.5008620023727417"
"Reminder The rules are there for all our benefit. Please report any violations to keep the quality up. Posters, this is a general reminder and no reason to panic I am a bot, and this action was performed automatically. Please contact the moderators of this subredditmessagecompose?to if you have any questions or concerns.","neutral","0.6488158702850342"
"I mean if you know a little about the details of his situation it seems pretty believable. The mob got involved in his incident which is what caused the FBI to stumble across him and what he was doing. Im sure he gave them every piece of information he possibly could. Its not implausible to think that the agents working his case are still there and they could still have contact.","approval","0.6779212951660156"
"My top left adult canine never came in. It rests just above the baby one and if I push on my gum line through my lip its very easy to feel.","neutral","0.9181203842163086"
"I was hoping the manufacturer of such a breaker wouldve figured that out so I wouldnt have to. If I were to make one, it would be an overvoltage protection breaker that monitors the phase to neutral voltage of both phases, and trips if at least one of them passes a threshold.","optimism","0.8418168425559998"
"I mean its just Yaldys reality with a happy coat of paint. Would you have accepted Yaldys reality if he added and everyone will smile and feel happy with their lives.?","joy","0.3330407738685608"
"Didnt stella sora flop on release? Not sure about the details but saw a lot of people complaining about it, checked it on playstore and it had really low rating","confusion","0.28289446234703064"
"I would guess that its just a kind of laziness preference. And as desire for automatics rose, manufacturers pivoted that was as it was overall far more cost effective than having two models, two types of transmissions to make etc. And once the needle really starts moving... shrug And I dont know any of the actual statistics but having lived in north America all my life but having spent plenty of time driving in Europe... I feel like we spend much more time sitting in traffic staring at red lights. And of course in those situations... A stick sucks. And even if you live in a large European city... I suspect its far more likely that you rely on transit than the US. new York notwithstanding joy","approval","0.3133821487426758"
"I was looking at the Scarlet Solo 3rd gen for 110, but I started watching more videos and I confused again. Here are the options Scarlet Solo 3rd Gen - 110 Scarlet Solo 4th Gen - 130 Scarlet 2i2 - 190 UA Volt 1 - 140 UA Volt 2 - 180 UA 176 - 180 UA 276 - 270 Motu M2 - 200 I just want to record my voice. Lets say voiceover or podcast. Maybe I will get a SM7B later on but which interface would suit my needs? I prefer the single input interface in terms of cost but I really want a good decent Interface. Probably that would not need me buying the cloudlifter or SM7DB.","confusion","0.7047901749610901"
"My post was at a time when the anger was very strong, now Im calmer after reading all of your stories and Im just going to focus on my recovery love","love","0.5816903114318848"
"Welcome to rJerkingInstruction! Stay safe 18 Dont share personal info, use anonymousencrypted accounts, avoid facetattoosidentifiers, set boundaries, and stop if pressured. Helpful links Browse or create a Safe Sexting Bot set up a private bot for safer, anonymous sexting. StopSextortion.com guidance and resources if youre threatened or blackmailed. Related subs 18 Please follow all rules and local laws. Note These resources are shared by users we cant independently verify every link. I am a bot, and this action was performed automatically. Please contact the moderators of this subredditmessagecompose?to if you have any questions or concerns.","caring","0.6395949721336365"
"great To every point of yours. And thats why I feel chance of extending the show are slim. Whats left in the show are friends to enemies arc only. Basser was amal nehal vs farahna are out so only gk vs Bajaj left. Bully gang is finished once shebaz is gone.","admiration","0.8664026856422424"
"Та й вона крінжова,я гуляв а вона одразу за ..ну ти зроз за що хапнула, я би також сіпався , ліл якщо ОП то читає то прикол ти не крінжова laugh а тіп реально просто боїться і не розуміє що робить, тут жінка поряд то такого життя не готувало","amusement","0.5273293852806091"
"Right thing to do!?!? They have an obligation to price things appropriately. Not like we are talking about a mom and pop shop here op. You messed up. Do you think if they had up charged you 20 they would even take your call?","curiosity","0.4172939360141754"
"Personally I find it a bit heavy and there is a big downside over your service issue pistol being angle of attack, with the pistol you have about 300 degree field of fire but with the short caster pitch gun and shotgun your limited to about 180 degrees in front of the tank In my experience most sticky rushes will come from behind you if they are able too","neutral","0.8035685420036316"
"When we traded for Bigsby, I was excited for him as a runner. Then he proceeds to only return kicks which he seemed to suck at. Now he gets to run and he looks like a very dangerous runner. Someone explain this to me.","excitement","0.7132410407066345"
"Post found on a few flyers around found area for those not on net. Also any VET free or the shelter can scan for microchip with owner info and you can register found with the shelter.","neutral","0.9526253342628479"
"Least is Shane by far. Got the exact right jury to get votes from I guess, but not a very impressive game and never gets to the end without Sharn doing her dirty work for her. Basically all the rest deserved it against their FTC competition.","neutral","0.49198731780052185"
"If i really wanted to it could probably have a laundry list of bugs and the fact some of the changes they have made got bad feed back and they reverted it back like tickets shows theres no hope. The game was released half finished. You cant even shoot through chain link fences that are all over several maps. Guns just straight not locking on or firing for vehicles, or firing and going through flares. Sniper headshots not working half the time. The games abysmal. Whats there is lacking at best as guns and maps and vehicles imo are not very good. But let alone stuff just doesnt even work and all the bugs. Game already is a hudge regret for me as a battlefield fan and I honestly want my money back. The hype and beta were more fun, I would rather go back to it not being released.","disappointment","0.38134005665779114"
"Everyone having their user flair set is a key feature of our subreddit. Please consider setting your user flair based on your nationality and territory of residence. Thank you for being part of our community. I am a bot, and this action was performed automatically. Please contact the moderators of this subredditmessagecompose?to if you have any questions or concerns.","gratitude","0.9476460218429565"
"אני שואל בכנות - איך אדם מגיע למצב שהוא מתעניין בסכסוך מספיק כדי להכיר כל מיני פסוקים והגדרות מהאיסלם, אבל בשום שלב לא הסבירו לו מה משמעות המילה מצור? המילה הזאת היא הבסיס למדיניות של ישראל כלפי עזה ב20 שנה האחרונות, משתמשים בה בחוק הבינלאומי וישראל משתמשת בה. לא להבין מה המילה אומרת זה לא להבין מה קורה בעזה מבחינה חוקית ומוסרית. אבל עכשיו אני מקבל את השימוש שלך במילה מצור זה לא השימוש שלי, זה השימוש של כולם בהקשר של עזה, ובעיקר של מדינת ישראל. למשמעות העתיקה אין רלוונטיות בדיון הזה, רק למשמעות כפי שהוא הוגדר באמנת סן-רמו. הדיון בינינו לבין המוסלמים הוא לא רק על השטחים שנכבשו ב67 הסכסוך הוא הרבה יותר רחב מהשטחים שנלקחו ב67, אבל הפתרון לסכסוך עובר דרך סיום הכיבוש. דאף אל מואמינין אז אתה טוען שכל המדיניות הערביות שעשו איתנו שלום זה בגלל שהם מוסלמים ובגלל הפסוקהלכה של דאף אל מואמינין? מה לגבי מדינות ערביות עם ממשלה והנהגה חילונית, למה אכפת להם מההלכה הזאת?","neutral","0.8927772045135498"
"dignes rabbit proxy u dva klika lokalno ili dignes squid u lokalu .. ili ako ti je bitno tacno sta i kako prolazi kroz proxy dignes u lokalu fiddler bolje od njega nisam vidjao iako je windoze only ... za realne proksije sa geopozicijom u srbistanu ces morati da platis, free koliko znam ne postoji eventualno tvoj provajder mozda ima neki proxy ali samo za svoje korisnike ... i srpski ip-evi kostaju solidno vise nego zapadna evropa i znacajno vise nego usa i obicno su to razni malware-i instalirani sto po telefonima ili racunarima neupucenih zrtvi","neutral","0.9538534879684448"
"Ive met only one. Josef. He is a YouTuber and lived not far from me. So I encountered him in a local health center. He has Russian wife, so they moved from USA with all their children. On his YouTube he tells how much he is happy to live here.","neutral","0.8187643885612488"
"Not every person who didnt like TLJ falls into this category. Not even close I woukd say. There are valid reasons to not like the film, and thats ok. However the vocal minority lost all their cedibility with the tantrum they threw over every little thing, and they way they did it. You know who you are. Those people should not be catered to. Its the worst thing they could possibly do.","disapproval","0.4221005141735077"
"Hello uImpressive-Ad-5842, To help keep rOver30Selfie a positive and engaging community, we require that accounts meet two basic criteria before posting Account Age Your Reddit account must be active for a certain amount of time. This refers to how long your account has existed on Redditnot your personal age. Karma You need to have earned a minimum amount of karma through participation on Reddit through posting and commenting on other peoples posts. At the moment, your account is too new and doesnt meet either the age or karma requirements. Once youve built up more karma and your account has been active longer, youll be welcome to post your own Selfies! We do not publicly disclose our Account Age or Minimum Karma requirements. Please do not write us and ask what our requirements are. Reddit does not require Subreddits to tell you what their posting requirements are. Please note - Our Account Age and Karma standards are subject to change, so even if you have posted here before, at the time of this post you do not meet the current standard. While we apologize for any inconvenience, We appreciate your understanding. We look forward to seeing you join our community. I am a bot, and this action was performed automatically. Please contact the moderators of this subredditmessagecompose?to if you have any questions or concerns.","caring","0.33275434374809265"
"This is SMALL CUTIE - it means the post must contain a petite girl All 18. If in this post there is NOT a small girl, please use the REPORT BUTTON Check the next subreddits as well rLoyalGirls - Loyal Girls - Dont miss it rNudeGirlsHub - Real Nude Girls rHotWetPussy - HOT - WET - PUSSSY rTelegram_Slutty - Slutty Girls on Telegram rCollegeSluts - College Sluts!!! rNUDE_SELFIE - Hot nude Selfies I am a bot, and this action was performed automatically. Please contact the moderators of this subredditmessagecompose?to if you have any questions or concerns.","neutral","0.8116838335990906"
"I would urge caution going in with 45 lbs. 15 lbs with the vest certainly isnt nothing, but this is both tripling the weight and altering the load distribution. Its what I think many would consider a pretty big jump. Im not saying dont do it - a good rucking weight comes down to your current level of fitness, other prior weighted carry experience, body size, etc. If you are a pretty big person, maybe this is manageable. However, perhaps consider for your first few rucks some shorter loops that you can repeat so you have a chance to bail early if needed. In addition to the plates, I like to carry a small first aid kit and a small pocket knife.","neutral","0.5188499689102173"
"The filibuster is extremely easy to remove if a majority is sufficiently committed to removing it. Right, again, your argument is that because it is possible for Republicans to overcome the Democrats, then the Democrats arent really blocking them. Because it would be possible to destroy the obstacle. But thats ... not what it means to block something, right?","neutral","0.5128982067108154"
"No. Im an Indian who primarily learnt English and Malayalam, along with some very basic Hindi. Although I can speak Hindi and can read and write it, this is not the case with a lot of people from Kerala or the rest of South India. Its not just tamilians. This is also the case with a lot of my friends from North East India. The 43 youre talking about are not native speakers but the ones who can speak Hindi as a first language. Switzerland recognises French to be its official language although its spoken only by 22 of the population. People shouldnt be forced to forget their mother tongue and forced to recognise a language which is strange to them as their native language.","neutral","0.6355788111686707"
"Thank you for posting! Please check out some of our other subreddits rEgirlFeet rNaturalgirlfeet rFeetAny Happy posting! I am a bot, and this action was performed automatically. Please contact the moderators of this subredditmessagecompose?to if you have any questions or concerns.","gratitude","0.9596126079559326"
"i think im an exception but i started 8 days ago on 50mg! And Im feeling amazing already The rumination and anxiety spiraling cycles fully disappeared by day 5. The first 2 days were pretty bad where i couldnt sleep more than an hour or two at a time and I had night sweats and was basically lying half dead and having mini panic attacks entire days. And like 3-4 it was already significantly improved but i still had random strong feelings of badness. And now ive been feeling normal","nervousness","0.39091259241104126"
"Im fully aware, Im fully aware that its a layered representation of the characters that are the sum of her. You cannot convince me out of a gut feeling that theres just something weird about it.","neutral","0.3795880079269409"
"You can transfer the 25K to Invest I did a transfer to my rrsp got the card and the 5 bonus. I believe the 25 k count toward your assets with WS TFSARRSPCash","neutral","0.8874639272689819"
"I can do Cuba 2 x4 if that helps. I need Rome 1 x3, Florence 3 x1, Seoul 2 x2 or Boston 3 x2? Just to give you some options on what I need grin Salah 2025","neutral","0.6178862452507019"
"Other subreddits you may be interested in rRice_Cakes - All kinds of beautiful Asian ass rJuicyAsians - Asian babes with a little extra oomph rTittydrop - The internets epicenter of titty dropping rAsiansGoneWild - An outlet for Asian women to express their sexuality I am a bot, and this action was performed automatically. Please contact the moderators of this subredditmessagecompose?to if you have any questions or concerns.","neutral","0.7090567350387573"
"oh word so he doesnt actually pick the winner like you originally commented, but instead you moved the goal post and now its he picks the time, which no one is arguing against. it actually makes a lot of sense otherwise the richest of the rich will use millions of coins to get and resell the song within 30 minutes. this also gives more opportunity to time zones on the other side of the world to get the epic.","neutral","0.853887140750885"
"Looking at the older leagues than Breach, we have a few that are still in the game but are ok because they are basic, non intrusive, like strongboxes or shrines. The next one that should be looked into if ggg want to improve it and make a sequel is Harbinger. Its outdated af.","neutral","0.6081793308258057"
"I prefer hybrid, anyways, but theres a difference between going from 60k to 80k and going from 200k to 220k. The former, Id 100 take it without hesitation, the latter I would be more nuanced depending on what the new job offered and what I was trying to accomplish by making the switch.","neutral","0.6115109324455261"
"Nu formule 1 kijken en jointjes roken en chips eten. Ik ben morgen ook vrij, dus ik kan het laat maken Verder wel leuk weekend. Vrijdag had ik mijn moeder uitgenodigd om te gaan lunchen. Gisteren niet veel gedaan. Eigenlijk alleen maar gamen battlefield 6. Vandaag had ik uitgeslapen tot 13u. Toen wat huishoudelijke dingen gedaan.","neutral","0.9254139065742493"
"Id personally take the cop to small claims court if you actually have all that evidence. Sue him for your wasted time taking off work, commuting to the court, etc. its only like 60 to file a claim, which youd just tack onto your lawsuit. You dont need a lawyer for small claims, so Id be petty and do it for wasting my time.","annoyance","0.4844561517238617"
"Did you see this person put all the papers there? Did they leave them? What if the person in that seat before then left all those papers? Im not going to judge someone for not doing anything wrong. If he cleans up the area before he leaves no harm no foul. Im not convinced its even his paper, could be the person behind him.","confusion","0.8049666285514832"
"You should really send it to ncsoft, they might buy the code off you or something and itll benefit the game, as impressive as this is Im not downloading anything off someone I dont know.","admiration","0.7987896203994751"
"If your post is showing off homemade salsa, be sure to include the recipe typed-out in a comment is fine, otherwise the post will be deleted in 2 hours. If your post is about something else such as a question youre OK and may disregard this automatic message. I am a bot, and this action was performed automatically. Please contact the moderators of this subredditmessagecompose?to if you have any questions or concerns.","neutral","0.6316024661064148"
"This is just demonstrably incorrect analysis and I presume you know that on an psycho-emotional level. Also, the IRS could have finished their 2008-2021 or 2021-2025 financial audits and brought charges if you really want to wade in semantics.","disapproval","0.7069546580314636"
"Its almost as wide as an Audi Q8 - which is why its classified as an SUV-Coupe Parking is a similar issue like with SUVs I had no issues with rear view camera and getting out of the car but i am 185 - 81kg and live in germany, we might have more bigger parking spaces then UK","neutral","0.8267471194267273"
"That light blue cloth hood? Ive had that drop before and it is very good. This is my point stuff like this should be documented and Im surprised that an addon doesnt exist to track stuff like this.","surprise","0.6952010989189148"
"I mean not really because Im gonna reset anyways waiting until the 31st is just a choice I made but I should still try not to look at her too much I wouldnt wanna goon myself into not knowing what day it is","neutral","0.5627944469451904"
"Thank you for such an informative reply! Ill definitely have to take notes on some of the recipe stuff you wrote. In terms of purely time, how long would you estimate each portion takes every week grocery shopping, prepping ingredients, cooking, washing dishes, storing the food? Im actually surprised that none of your family makes what you eat because many of my friends and family usually eat home cooked stuff that a family member makes Idk if this is an asian thing or not. I actually used to eat my dads cooking which I didnt like, so he ended up not cooking anymore as much. Its really refreshing to hear that it doesnt always have to be a communal activity.","gratitude","0.8263282775878906"
"Premade Group Filter addon already exists and lets you filter on more options or just arbitrary text. I use it to filter out any groups with voice required as theyre 99 these spam groups.","neutral","0.8468862175941467"
"lol yes work remotely 160k salary but not a 50 bonus more like 35 depending on how well company does and was recently laid off a few weeks ago so currently unemployed AND husband is currently in government shit down works for the feds so he is not getting paid since October 1. So yeah. Thats fun. No income for either of us He was also WFH for the past decade until they hauled everyone back in office this year which makes zero sense for the type of work he does. SMH.","amusement","0.8182357549667358"
"Join the Gachiakuta Discord Server for more discussions about the series! I am a bot, and this action was performed automatically. Please contact the moderators of this subredditmessagecompose?to if you have any questions or concerns.","neutral","0.717644214630127"
"I dont bother waiting for a free upgrade anymore. Like yesterday, I just rolled my eyes and bought the upgrade. Kind of regretted it. The guy next to me was coughing and blowing his nose the entire time. Almost declined the drinks and the food because of that.","remorse","0.6175383925437927"
"Commenting on New to Linux, which distro should i choose?... Im also new. I tried ubuntu, but I kept getting an error during installation, so I tried second option, fedora. Its working fine for me.","neutral","0.31205952167510986"
"I love eyesight I have a 2015 Liberty Legacy outside of Australia Eyesight has been fantastic. It has helped me countless times. Today I am picking up another Subaru 2025 forester touring. The legacy is going to be my sons first car. All the safety features give me assurance for him. In fact on the weekend he just did a defensive driving course in the legacy. He had to disable the eyesight traction control and lan departure systems for the track and skid pan driving. He told me even with those off the car was so stable. The instructor commented how well the Subaru handles in emergency braking, high speed turns some small under steering. I have no concerns with the eyesight or CVT. You just need to be servicing the Subarus on time.","admiration","0.5697095394134521"
"I also think Im going to make a wall of shame and put their name on it if theyre being too unhinged- but that might do the opposite effect and encourage the behavior death","neutral","0.40837693214416504"
"When I played bg3 with the first time I had something like 5 other friends playing it and I swear to god when I talked them about it, it seemed like we were playing 5 different games, I still cant belive that this game was possible to make. Hands down my game of the decade for now","neutral","0.42907145619392395"
"Ugh, do they even say in advance that they will bring their BF? Do you think that their BFs are insisting that they come? Do you have a BFhusband, and do these women know your status?","neutral","0.5274434685707092"
"Is it legal to have a garage full of tires? Is that dangerous during a fire? Should the fire marshal know, if nothing else so firefighters will know what hazards might exist during a fire?","curiosity","0.6046304702758789"
"Yeah, you already know its bad for lungs, heart, cancer all that. The fact you want to quit says a lot. Its not about knowing its harmful anymore its abt finding what help you actually stop..take small steps, less access and staying strong when the urge hits.","neutral","0.3346884250640869"
"Yup, shittiest nails ever. Paper thin, break and flake. My thumbs are very bumpy and will split at the start of the nail bed or if the bumps get really bad they split horizontally. Nothing has really helped but I put on a strengthener to close every up shrug","neutral","0.6457193493843079"
