"comment","harmful_label","score"
"Iedomājies ka tu smēķē visu savu dzīvi - velc tos dūmus plaušās. Kā tu domā vai tev dūmi traucētu, ja kāds tev blakām smēķētu? Smēķētāji ir pieraduši un tiem tie neizraisa diskomfortu, tāpēc tie nesaprot par ko te jezga. Aizrādījums uztveras kā diskriminācija. Cilvēkiem dažādas perspektīvas. Un smēķēšana jau ir aizliegta pieturās, pie ieejām un tam līdzīgi. Pat uz balkoniem neesmu drošs vai var. Pēc fakta jau vari policiju saukt. Vienkārši neviens to nedarīs.","neutral","0.9092364311218262"
"For Kintetsu trains, the Limited Express seat fee is an extra charge on top of your base fare. From Osaka Namba to Shiroko, the seat fee is around 1,500 to 2,000 yen depending on the train and time of day as far as I remember. You need this ticket because all Limited Express seats are reserved. You can buy the Limited Express ticket at any Kintetsu station from a machine or ticket counter. Just tell the staff or select your departure and destination, date, and time. You can also book online through Kintetsus English website and pick up the ticket later. If youre using the Kintetsu Rail Pass, it covers the base fare, but you still have to pay the Limited Express seat fee separately. Once you arrive at Shiroko Station, you can take a short local bus or taxi to Suzuka Circuit. Since its for the F1 weekend, trains will be crowded, so its smart to book the Limited Express seat in advance to guarantee a spot and a smooth trip.","neutral","0.8135703802108765"
"I assume you are from Norway then? The amount of reported crime per 1000 people in 2010 used to be 81.1 crimes, the immigrant population of the time was only 13 of a million. In 2024, 59.8 crimes per 1000 people were reported, despite the immigrant population having doubled since then reaching 0.63 million So, if immigrantion was really importing crime, wouldnt the rate of crime have doubled instead of fallen? Crime is a socioeconomic factor, poor people commit more crimes. And immigrants are more likely to be poor as they come to countries without really any networks, they then are stuck doing low-wage jobs. This makes people turn to crime.","neutral","0.40407630801200867"
"Yes as long youre normal about it meaning youre not obsessive and keep it to yourself. I wont tell my boyfriend which actors I think are hot just like I dont want to hear it from him.","neutral","0.6606023907661438"
"Tiana is AMAZING, shes the owner there at hair sanctuary love shes been doing my hair for over a decade now and no matter the color, color correction or very specific cut I want, she absolutely nails it cry Ill never go to anyone else ever again love","admiration","0.8086192607879639"
"Hi , This submission has been automatically removed because it is very short. Its quite likely that the post breaks one of our subreddit rules Your thread may need more detail or its topic may not be allowed by our rules such as no questions with a specific answer or no questions that generate short answers. If your thread was asking for suggestions about what games to get then you should look at asking either , , or . If you are looking for the name of a game then you should try . Please send us a message if you think that the bots removal is inaccurate. I am a bot, and this action was performed automatically. Please contact the moderators of this subredditmessagecompose?to if you have any questions or concerns.","neutral","0.6792237162590027"
"But were talking about a theoretical boxing match with real physics in place, one person just happens to be invulnerable. If you get ragdolled around without being competitive, the ref will call off the fight. It doesnt matter if youre physically capable of continuing. The theoretical match here is a boxing match with boxing rules. Whats the point in adding 150lbs to the prompt? Why not 2lbs? Clearly its because it affects the outcome. Also its literally in the OP prompt He can still be knocked and thrown around, but he will never cut or bruise, never be injured, never feel pain, and never become dizzy, fatigued, or out of breath.","neutral","0.6242890357971191"
"I think its clear that Im not alluding to the technical difficulty of the language, but rather the mental barrier a lot of language learners face in acquiring their first other language.","neutral","0.46851083636283875"
"You understand Wanda and captain marvel and doctor strange the hulk and Thor were all there. Cap black panther and iron man to boot. Throw in a little Spidey and the guardians . I think Im going with the endgame heroes here.","neutral","0.9013143181800842"
"The lyrics of his personal theme do mention bending space and time, and while the latter is less obvious, he did more or less skip the entire night in the last episode, though that may just be time flowing differently in the special dimension he was in.","neutral","0.7050437927246094"
"Honestly on his record I think hes going to have a hard time Record homelessness Record high cost of living Record high cost of housing Highest state taxes in the country Billions spent on solving homelessness Billions spent on high speed rail Billions in surplus with no infrastructure spending Surplus to deficits Cleared out homeless from SF for Xi, afterwards ignores the problem Hes a typical politician with no real results to speak for","neutral","0.5095698833465576"
"I like his idealism and the fact that he used his trauma as fuel to change the status quo. I know that he was kind of an idiot with some of his plans. But at the end of the day he was pretty close to achieving his goals and played most of 7 stars as fools. He rose from being an orphan sex toy of a politician to being a well respected warrior and politician.","admiration","0.6308168172836304"
"Pour ça en autre que je privilégie Threema. Payant en 1 fois , serveurs 100 Suisse comme lentreprise qui servent que de cache , car si ton contact est connecté ça passe pas par leur serveur mais en P2P directement.","neutral","0.9592748284339905"
"Hey there! Are you here to advertise your Onlyfans? If yes, this message is meant for YOU! There is a popular and rising Shout for Shout program going on that is meant for Onlyfans models to work together and gain fans the fastest possible way just by working together! The program is completely FREE No strings attached and you will get into properly maintained group with other models to work together and gain massive amounts of fans! Shout for Shout programs are proven to be the most effective method of advertising amongst the Onlyfans Models and everyone is praising for their usefulness! Join today and get into the action - Read more on the channel! I am a bot, and this action was performed automatically. Please contact the moderators of this subredditmessagecompose?to if you have any questions or concerns.","approval","0.5213103890419006"
"Explicit content Free Click HERE Telegram I am a bot, and this action was performed automatically. Please contact the moderators of this subredditmessagecompose?to if you have any questions or concerns.","neutral","0.6508271098136902"
"Race manipulation is changing the outcome for more than just yourself. If you choose to ride around in the back of the pack the whole race, it only affects YOUR race. Nobody else. Please explain how that manipulates the race? In what way did it change anyone elses race day? Now if the ran in the back and then slowed down or blocked certain lead pack cars, THAT would be manipulation.","neutral","0.5137292742729187"
"Why are you asking? What news have you been following for the past 10 years? Youre asking for too much. If you explain your understanding of all the laws that were broken and people who went to prison, MAYBE Ill get bored and help you fill in details. Im not here to educate a fool with 0 knowledge.","annoyance","0.4986705482006073"
"Just a heads up this post has been locked, as ALL posts on rdirtyr4r are. This is because personal ads are not discussion topics, and rdirtyr4r is not a discussion forum. READ THAT AGAIN. This is a busy subreddit - if you modmail us to ask why your post was locked we will have to block you for a week. Responses should be PMed to OP directly. Heres a convenient link . Do NOT give anyone on reddit your phone number, Instagram or WhatsApp or any contact info telegram that could be used to find your phone number. Some losers are using it for facebook-look-ups to doxblackmail redditors. Do NOT offer or request to share picsvideos of anyone other than yourself. It breaks our rules, and reddit is also likely to suspend you for it. If they message you, -Economist9528 is not a mod they are banned here for attempting to impersonate a mod If this poster is breaking our rules, please use the report button AND send proofscreenshots to the moderators. I am a bot, and this action was performed automatically. Please contact the moderators of this subredditmessagecompose?to if you have any questions or concerns.","neutral","0.7969840168952942"
"Join Walkers Unite Clan Clan level 27 Regular Wars Twice per Week Maxed Out Capital Hall Level 10 Clan War League - Masters III, 30v30 Bonus CWL medals awarded to top ranked attackers","neutral","0.9231293797492981"
"You know, at least MAGA and GOP can be united in their grifting and corruption. Democrats cant keep a fucking front on truth, reality and integrity for the life of their fucking brand and party.","annoyance","0.5294304490089417"
"Cant believe no one commented with the answer yetthe song is Me Me Me by Catz 'n Dogs, Nala I know it from the Dom Dolla b2b Solomun Live The Wool Store Melbourne, 2024 video, but the original is great too.","admiration","0.7109810709953308"
"This user has posted more than once without verification. This can be a fake or catfish account. Be careful. Also, verify yourself to remove this message. You can also visit fuckonlive.com to watch live and horny indian girls for free. I am a bot, and this action was performed automatically. Please contact the moderators of this subredditmessagecompose?to if you have any questions or concerns.","caring","0.840876042842865"
"HentaiSauce_Bot was unable to find the sauce. Calling u2Dgt3D for the sauce. I am a bot, and this action was performed automatically. Please contact the moderators of this subredditmessagecompose?to if you have any questions or concerns.","neutral","0.797951877117157"
"I have a few accounts, each for different interests of mine. Its allowed to have multiple accounts BUT you cant vote on the same postcomment from different accounts if you are banned from a subreddit on one account, you cant participate there on other accounts. So you have to be careful.","caring","0.708308219909668"
"Wasnt there a big post just yesterday criticizing Ambrossi for being outside a polling place along with Healy? I am sure there will be similar outrage over this campaign rally outside city hall, which is an early voting location.","curiosity","0.5858752131462097"
"Welcome to rFastSexting! Stay safe, follow all rules and remember, your safety and privacy come first. Always think twice! join fastsexting discord server our affiliates - hedoncustoms is the best platform for buying and selling custom content 18 fast. I am a bot, and this action was performed automatically. Please contact the moderators of this subredditmessagecompose?to if you have any questions or concerns.","caring","0.8178009390830994"
"Mountjoy for 630K is bad value in my opinion. The area is not great and that is A LOT of money. How much interest is that? or you pay with cash.","disapproval","0.7239958047866821"
"Hello ! Thank you for posting on rHentaiAndRoleplayy. Make sure your submission follows the rules! You can find them in the about section, or the sidebar of our subreddit. As a reminder Any submission which breaks the terms of service, doesnt have a plot stated in the title, requests feedingtrading imagesmessagesnudes, or features unapproved advertisement, will result in a ban. We highly encourage users to report submissions breaking the rules, as we have an active modteam making sure you have a satisfying and safe experience. If you have any feedback that you need to tell us, please send us a direct modmail by clicking on Messaging the moderators on the sidebar, or on mobile by clicking on the three dots in the homepage. I am a bot, and this action was performed automatically. Please contact the moderators of this subredditmessagecompose?to if you have any questions or concerns.","gratitude","0.8125929832458496"
"Ik o koqe. Your argument is weak. Here is the data. It has nothing to do about race, you are just race baitign. Lexoje. Ata immigrant ne grupet e kuqe Jane net negative economikisht","disapproval","0.4753500521183014"
"rkollywood is now on Instagram, YouTube Spotify! - Instagram - YouTube - Spotify - Discord I am a bot, and this action was performed automatically. Please contact the moderators of this subredditmessagecompose?to if you have any questions or concerns.","neutral","0.7040113806724548"
"I dont like her and this doesnt help. Much smaller creators are putting out way better statements with a stronger stance. This just screams I need to say something because all my peers did","disapproval","0.5752600431442261"
"Played an indie VN called Mobile Murder Mystery. Its short and sweet, and its themes regarding isolation resonated with me. Ive also been playing Digimon Story Time Stranger, Ive really been enjoying it. Im looking forward to seeing how the story develops.","joy","0.8983075618743896"
"I mean as a European Vances talks about us were also pretty odd to me besides being completely wrong on everything but hey. Thats life. Or, in that Context, Musks actions here. All very odd. Everything Republicans are doing is very odd to me.","neutral","0.39084094762802124"
"I thought literally every single person who played Crystal Shards remembered her because of the ominous look she gives the camera at the end when you cant be bothered to get one of the more annoying crystals.","annoyance","0.5021658539772034"
"Same here, wifes iPhone, iPad and Mac calendars are empty! I tried everything, sync from icloud, restore turn offon the sync but still nothing. Why does this happen? Is there a way to open a ticket?","disappointment","0.32884955406188965"
"How is meat easier to access? instead of buying and eating 10 different veggies you can get the same nutritional benefit from 1 piece of steak Especially in a cost of living crisis? I switched from NY steak to a mix of NY steakporkground beefchicken. Its not hard unless you are literally homeless. Its also harder to store. Not true, you can get a quarter cow and its good in a freezer for 1 year If anything veggies rot faster than meat since you cant really freeze them as easily Nutrition isnt better, the body needs carbs and fiber, The body doesnt need carbs, its just that it converts carbs into energy faster than proteinfats. Fiber is there to allow you to shit easier. But otherwise steak and eggs are incredibly nutrient dense that you dont need much else besides the supplemental veggies for fiber and some fruit for taste. You keep ascertaining that less meat and veganism is the same, and a cult. Can you please clarify why that is? Do you know what a cult is? You dont see meat eaters advocating for eating less veggies, they just eat meat, lift weights and get jacked. All I see is vegan zealots propagating the false gospel of veganism and how holy they are because they love to chew grass. That, homie, is a cult.","neutral","0.45510855317115784"
"The wasian sons usually end up inheriting the white dads bwc when they reach adulthood but a lot of white guys are scared and dont wanna take that risk and worried about them having a little Asian dick but most of the time thats not the case","fear","0.4654473662376404"
"Enjoying something that was made with no soul? Now thats embarassing. Each and every one of DVlopers games werent made by AI, and theyre great, but this update is dogshit","disappointment","0.3134244382381439"
"I feel like Claudio would make more of an ally for Bond, while Victor is Bond, maybe Hwoarang as a big mobster they fight on their way, and Steve well idk, maybe Bryan as the Antagonist? Or Dargunov","confusion","0.6503456234931946"
"Im struggling with the exact same thing currently. If Im sober I start hitting my head and shaking it to try stop the thoughts but obviously that doesnt help. Im 19F too, lost weight, cant sleep, quite unwell. People always say to stop drinking but they dont understand what its actually like having a constant 247 bully in ur head","disappointment","0.39135369658470154"
"The lyrics are not the issue as much as how they are delivered, and also the beats have not aged as well as other albums from the mid90s. That being said, I respect Hov a lot for consistently dropping albums for 10yrs straight, with many of them being outright classics, and others hood classics","admiration","0.6029228568077087"
"sorry for you but those arent original Seiko parts, everything comes from a china. Its a cool build but if he advertised the watch as made from original Seiko parts Im pretty sure he lied to you","remorse","0.6660445332527161"
"Proponuję tak - wschod slonca zawsze bedzie o 4.30, zachod zawsze o 21, codziennie zmieniamy godziny zeby sie do tego dostosować, czasem mamy doby po kilka godzin czasem po kilkanaście ale wszystkim wszystko pasuje","neutral","0.9268185496330261"
"Its exactly the opposite of how a true Christian should act. Im so sorry youre feeling this pain. Its your fathers loss. But heartache is heartache-Im just so very sorry this is happening. Such a useless waste of love.","sadness","0.7495379447937012"
"Not supporting golf here, I have a very George Carlin mindset about golf, and I dont have much insight into how they deal with other pests, but I know for ants most courses use a mixture of water and molasses to manage ants. The molasses encourages bacterial growth that eats ant larvae.","neutral","0.6441816091537476"
"Please be respectful and follow the community rules. This is a place for people who love rep sneakers to share, discuss, and enjoy. No drama or disrespectanyone causing problems will be sanctioned and may be banned I am a bot, and this action was performed automatically. Please contact the moderators of this subredditmessagecompose?to if you have any questions or concerns.","approval","0.6312714219093323"
"It sounds like opportunities might be pretty limited there, which sucks if so. If thats the case, I would not let anyone win, but if they hit more and more gas a 3 will, Im not here to work that hard so let them get tired and worn out. No need for me to. Do what you do well, but dont kill yourself to win, just work in a way that you feel good about the work youre doing, apart from results. Let them carry the burden of results. Its fickle and always wants more. Thats their lesson to learn. If its something you really want, just count the cost. What do I get, and what does it cost? Am I willing to pay? Usually the answer is no, but that allows you to really go all out when its truly a yes.","caring","0.34120383858680725"
"Went to the big orange bookstore in my city you-know-which and for the first time I saw a separate bookcase committed to manga! I was so surprised. Of course the collection was all over the place, with Greek and English volumes and with no consistency, but still a good thing!","surprise","0.8012909889221191"
"Your post has been removed because you do not meet the minimum karmaage requirements for posting. These measures have been put in place to prevent scammingabuse. PLEASE READ THE ENTIRE MESSAGE CAREFULLY BEFORE USING MODMAIL In order to have your posts not be removed, you must do the following - Wait until your account is at least 3 days old - Acquire at least 10 karma on your Reddit account You need to meet BOTH of the above requirements to be able to post. If you do not know what karma is or do not know how to get more karma, you can refer to this link You cant get karma by posting here because your posts will be deleted, so youll have to go to a different subreddit and post there. I am a bot, and this action was performed automatically. Please contact the moderators of this subredditmessagecompose?to if you have any questions or concerns.","neutral","0.6835364103317261"
"Beacon Hill usually has them, either at the Carniceria or the spot across from MacPhersons Abarrotes El Oaxaqueño although I dont recall seeing any just yet. Ballard Market had some for 15bunch and I vaguely recall seeing fake ones at the Seattle center Dia de los Muertoa event.","neutral","0.862984836101532"
"Thats exactly my point. People who have all their diplomas in June or people who have already taken them will have grades 3-4 lower than people who didnt even have to take them. My solution is postpone the January diplomas by about 8 instructional days to allow for equal instruction between the two sectors, or reduce the weightings. 30 weighting is unfair for you, yes, but 0 and insane grade inflation is also unfair too.","neutral","0.44202467799186707"
"If we just try to hustle and grind we end up like crabs in a bucket. This is a societal problem and it needs systemic solutions. We should be emulating the French, not building a faux American exceptionalism.","neutral","0.41409730911254883"
"Thanks! There has to be something cheaper than 300 out there tho. Im also afraid of theft bc its an apartment parking garage. I feel like its only a matter of time before it gets stolen. So it would be better it was a cheaper item than 300","gratitude","0.9053741097450256"
"Personally I wouldnt worry too much about shit getting expensive. As a dad of 7 years whos been in your position, Ive found the following is true 1. With a kid that small it will be a miracle if you get to t16 maps in 8 weeks lol 2. By two weeks in there are normally some massive shifts in the meta as people figure out whats completely fucking broken this league and word gets around. You cant predict what that is and if it involves build enabling items for your build youre fucked. 3. Conversely, if its not your build, even if your build is pretty meta, youll find tons of people switching away from your build and selling their stuff by 2-3 weeks into the league. Prices for anything except the rarest uniques generally come down over time. 4. It actually gets easier to farm more currency later on because things like harvest have a window where theyre worth a lot that hits a couple of weeks in. So look at what is actually valuable if you do make it to endgame farming and focus on that. I always make a shitload of money getting up into red maps just from adding harvest everywhere. The old Niko node that got nerfed was great for this too, resonator prices went up as people started crafting in earnest.","amusement","0.789197564125061"
"Please read the recent reminder of our rules before commenting or posting. Thank you! --- ukennyben1486 has the following flair 293 Trades gsball Users must finalize discussion in the comments before moving to PMs. ukennyben1486, do not deal with anyone who cannot comment on your post. Click here to learn how to leave feedback and increase your flair count! All our rules and guidelines can be found here User trade counts can be found in the user flair next to their name. To see a detailed list of references, click send on this message If you believe you have been scammed, please fill out this form --- I am a bot, and this action was performed automatically. Please contact the moderators of this subredditmessagecompose?to if you have any questions or concerns.","gratitude","0.46700266003608704"
"Your account is not old enough or does not have enough karma to post here. Try again in the future. No, we will not make an exception. Asking for the limits or number will result in your account being banned from this subreddit. Please see here on how Reddit Karma works I am a bot, and this action was performed automatically. Please contact the moderators of this subredditmessagecompose?to if you have any questions or concerns.","neutral","0.5445653796195984"
"Yall are Texas. The team given more credit for what yall could be instead of what yall actually are. Yall and Notre Dame are loved by the old AP writers.","love","0.5168936848640442"
"Vermutlich war da irgendwo in einem Schrank oder so eine Strickleiter, die man wo einhängen kann um sich abzuseilen. Hab ne Zeit lang in einem sehr alten Haus mit ähnlicher Situation gewohnt und das ist tatsächlich der offizielle Rettungsweg dann...","neutral","0.9075078964233398"
"Probably US centrism at play. We dont associate violence or gore with taboo in the same way we do a the suggestion that someone might have a nipple. Maybe its because we associate work with like, factory and blue collar jobs, where you might get maimed, but have a comparatively lower likelihood of seeing someones junk.","neutral","0.7196579575538635"
"Watching the trial in person was great, but some parts, like the wire taps were really hard to hear. Judge Everette had to create an overflow room for Wendis testimony, but other days most every one got in. But be warned, the courtroom is freezing!","admiration","0.602378785610199"
"One thing is funny you wanted her to support you after she giving birth to a child. Shouldnt it be exact opposite? I also felt that all you want to fun like back quickly after childbirth. I mean six months is too soon considering hormonal havoc that pregnancy does to someone. And I also felt only she is a parent and you are not that involved. Is this the case? Someone said in the comments that there is lot of me me me. Even I felt so.","amusement","0.8038802742958069"
