"comment","harmful_label","score"
"Ive recently started building lore teams, you of course have your Knights of the Round Table crew, then all the Argonauts weve collected, finally expanding on Alexander the Greats army, all the Fairy Knights, the Shinsingumi, and even just gunslingers.","neutral","0.8631559014320374"
"I believe the hinge is solid ..some people had issues with the slider tho, but it varies per person, due to head size, how much they stress the headbands, for my personal experience its the perfect fit.","approval","0.6799359321594238"
"Its not just the ligaments that are of concern. Its the location of the fracture. If it occured in the middle of the tibia the diaphysis it has a much better prognosis compared to a fracture that extends to the articular surface i.e. Pilon or bimalleolar fracture.","neutral","0.5361239314079285"
"Im sorry but a strict carnivore diet is absolutely NOT known to cure gout. The exact opposite has been proven, as excess amounts of meat, especially red meats and organ meats, increase uric acid in the blood, which then forms crystals in the joints, commonly known as gout. Check your serum uric acid regularly and be suspicious of any joint complaints. Take care!","caring","0.7436474561691284"
"Well, yeah. My argument was taking bad operators on classes with broken ones to say that the class can be weak despite them, their argument was taking a broken operator on a class with plenty of bad ones to say the class cant be considered weak because of them. My point was also that the class hardly means anything for the power level. If they want to sell a character on a bad class theyll just put something into their kit that allows them to ignore the bad parts of the class entirely, or just have them not play like the class is supposed to at all i.e. Kaltsit and Reed Alter are medics. Being an Executor Specialist didnt save Crownslayer from being bad despite the class being inherently strong, just like being a Vanguard is not a guarantee a character will be good because Ines exists.","neutral","0.7432084679603577"
"It pivots on the 45degree portion if hit and is supposed to twist back. Chan is so f it gets hit really hard you have a chance of it not getting plowed away.","neutral","0.924401581287384"
"I think Leclerc and Rusell could be successful. No I dont think they could beat Max but I certainly think they will be right behind him in the championship in that Red Bull.","optimism","0.3281378448009491"
"According to this list which is only a small sample size of 126 stores or so, so its not entirely accurate the top 4 selling comics last month had Batman in the title. Batman is what brings in the money, so thats what theyre going to focus on.","neutral","0.5265749096870422"
"In terms of aesthetic, MJ has its own unique look, and the only way to approximate that look is to either train your own LoRA Qwen, Flux or Chroma or find one that somebody has uploaded to civitai tensor. art, or various other similar model hosting sites. In terms of being creative, the best open weight one is probably Chroma, but it takes some effort to learn to prompt for it properly","neutral","0.7555761337280273"
"This I can relate to, its not a deal breaker if they dont though. I just fear that if I get into a relationship going forward that I might feel alone if that makes sense. My Ex cheated and I didnt talk to her for over a year, she sent me a text asking how I was doing and I opened up about my issues with incontinence and she mentioned shed wear diapers along side me to make me feel comfortable if we had been together. Not that I want her back or anything but it felt nice knowing that she didnt look at me differently and if things had been different would have went that far to make me feel good. But being single and not knowing if I will meet another, if theyd accept me or at the least be understanding or if the result will be rejection.","fear","0.4439101219177246"
"I would also say in addition to November donations due to food stamps defunding, the after holiday months like Jan-March are usually have a lot of need because everyone stops donating after the new year. Just something to consider.","neutral","0.7442313432693481"
"Yes I was wondering about the same thing - it is so frustrating when things arent anything close to deterministic or repeatable, it is like a whack a mole some days","annoyance","0.5426711440086365"
"Mucho se puede decir desde un punto de vista externo y general. Por ejemplo la forma en que ciertos grupos de poblaciones Judías hiper ricas habían generado préstamos en Alemania, que si se asociaban en general con políticos horrendos y gente tacaña, desagradable, hermética y muy mezquina con gente no judía, como hoy en día sucede Pero en general es más cosa de su visión muy... personal... Y eso la única forma de conocerlo es leer la de mi lucha de Adolph Hitler.","neutral","0.9280731081962585"
"Well apparently you didnt read the Wikipedia article very closely because if you had you would see that medical euthanasia was responsible for 4.7 of all deaths in Canada in 2023 Which is the last year we have public record for. In fact, if you go to the source for the Wikipedia article, they do indeed disclosed the numbers 2000 for 2023 on how many people will reject heed in how many requests were withdrawn Fifth Annual Report on Medical Assistance in Dying in Canada, 2023 - Canada.ca If you do get into it There were 19660 requests for using maid in 2023 15,344 people used the maid program 915 were rejected for Not meeting the legal standard, 496 were withdrawn by the participant and 2, 906 died before the procedure could be performed. This puts the acceptance rate closer to 93 rather than 1. Again, this is public record primarily because it is being used in ongoing litigation. In conclusion, 4.7 of all deaths in Canada for the year is quite a bit more than a few people and the rejection rate is much lower than you seem to think it is And talking people out of it is even lower. Not quite check mate","neutral","0.8300365209579468"
"Hard to tell. I believe itll be at 45 within 3 months but Im holding calls for a quick move this week for a breakout to 27-28. Thinking itll hit 28 next week the latest","confusion","0.537835419178009"
"Sure thing feel free to send me a DM and we can organise it there. Haha, its not so bad as I had those both on Orserks, which have a 100 chance to pass a breeding-only skill if kept at level 1. Orserk Lamball Chillet with 100 chance to inherit whatever skill youre passing like","amusement","0.7290220856666565"
"Listen here all you old timers, LOL now that I have your attention, do yourself a favor and listen to DRAIN. There a band from Santa cruz CA, but they seriously FUCKING rock. They even wear PanteraMetallica shirts, so they know what food music is. Songs id suggest are good good things watch you burn living proof feel the pressure California cursed those are all fuckin sick ass songs- whoever is reading this, u obviously have some time on ur hands so do urself a favor and listen to a couple songs theyll surprise the shit out of you. I used to think still do mostly that good rock music is and was just a thing of the past. That no one from this era, even comes close to rock n roll from back in the day. But Im telling you, theyre the bestclosest youll get to the badass shit we all know n love. NOW, Ill answer your question, lol - METALLICA, ALICE IN CHAINSLayne Stanley only, Iron maiden, Megadeath, pink Floyd, led Zeppelin, Credence Clearwater, one or two Tesla songs, Van Halen, motley Crue, sex pistols, misfits, social distortion, pennywise, and I fucking love old school gangster rap 80-90s and most but definitely not all rap from today. LAST BUT NOT LEAST UICIDEBOYS- G59 TILL I FUCKING DIE","amusement","0.8119053244590759"
"I had the exact same problem with my Daith piercing- it would sit more forwards then in my ear. My piercer told me this would happen as I got it pierced very shallow. My piercer also told me to get a fabric bandaid and cut little strips and stick it down every night. I did it for a week and it worked fine and I havent had anymore problems. I just taped the top of the earring to kinda like where youd get a rook or flat?","approval","0.4851982593536377"
"Hi! Heres a reminder of the rules. Dont break them I am a bot, and this action was performed automatically. Please contact the moderators of this subredditmessagecompose?to if you have any questions or concerns.","neutral","0.6809713244438171"
"Dont hate me for this, but the one thing I dont see is a way to safely use AI and automation in my work. I believe Microsoft is working on this work Copilot for Windows etc. In fact just forget AI, give me a desktop automation tool that lets me orchestrate apps and perform tasks. Later make it optional to connect AI. Agentic AI for the desktop? It has a nice ring to it but maybe oxymoronic. So yeah there are areas on innovation not happening on Linux.","neutral","0.4972066581249237"
"Your post was removed because there is simply not enough information provided for anyone to provide you with a useful answer. Before you post again, please check that youve provided us with a concise problem description in the title and not just please help!, so the right experts will open and read your post. Perhaps have a look at our Asking for help quick guide which provides guidance as to what to include and how to do so. This makes it easier for people who want to help you to be able to do so. In your post text, make sure youve given us all the information you have access to. More is better. Include your entire hardware layout, every component youre using, the circuit layout not a photo or video of wires, your computer code make sure you format it properly - NO SCREENSHOTS OF CODE, and describe what you thought would happen, and what actually happened. Include any error messages as well. You are encouraged to include a photo of your circuit andor a video of your project if it provides additional information, but these are strictly in addition to, not in place of a proper circuit diagram and code in a formatted code block. If you need more help please check the Sidebar for more information.","neutral","0.8849246501922607"
"Indifferent. I wouldnt mind having a single ID thats verified. Every job I go to now I have to create a new account with, upload my passport and driving licence, last payslips if I can find them, wait for them to find something Ive not uploaded or done. Its a bit of a faff. However, it cant digitally exclude those who dont have the means to use a digital ID. Those worried about your data being sold on, your data is already tracked and sold by private companies anyway","neutral","0.6759862899780273"
"Yes but those meek tall guys are still visibly dangerous and thus imposing. Ill add, I have a friend that is 68 300lbs and is the nicest most gentle person youd meet, but I watched someone egregiously cross a line with him and fully underestimate his size. Up until that day I had never seen someone lift a person off the ground by their jacket with one arm and punch them in the face with the other","admiration","0.24982360005378723"
"If you have or want a friendly relationship with your roommate, then yeah, you might be overreacting. You can let the know, sweetly, that you were hurt and give them a chance to make things right and if kindness doesnt work, and behavior persists, there are more issues than just the houseguest.","neutral","0.38211312890052795"
"The reason it shouldnt be changed is because theres no reason for the change. The current rules are easy to understand and simple. They dont require a lot of odd outliers just to justify a likely minor change. Why not make phrexian mana not count? Or symbols in a cards text? Its odd that a hybrid costed card can be in a monocolor deck, but a commander with that same hybrid cost would somehow not be monocolor? Also, typically the onus is on the people proposing a change to justify why its necessary, not the other way around? It just strikes me as odd why with so many actual issues with the format theyre instead focusing on trying to change one of the fundamental rules that has basically existed forever in the format.","neutral","0.4173290729522705"
"Pentax prime lens are severely underrated imo...a lot of them look amazing. Plus I have found using prime lens as a beginner helped a ton to force you to be closer and more intimate with the subject. I forgot who said this. If your photographs arent good enough, you arent close enough. Dont just zoom, be out there with whatever you are photographing.","admiration","0.5583308935165405"
"He doesnt seem to have any offense other than shooting threes. Every once in a while he tries to dribble a few times like he might attack, clearly has no ability to get by his man, then passes it","neutral","0.9058583378791809"
"not really but most people, not just women, just dont go around thinking of statistics on their mind. emotions and feeling are much more likely to rule our decision weither good or bad.","neutral","0.7028133869171143"
"Im a flex player. I dont preselect anyone because people will absolutely ban the character I preselect after I try banning Jeff, which would mean theyre actually wasting a ban since I have 9 Lord characters Ive been regularly using for competitive and many others I can play on the same level as well. I have at least one Jeff in the majority of my matches though and I have many reasons why Id not want to deal with players selecting him.","neutral","0.5832653641700745"
"Well obviously. Water cant rush into compartments above water. It can burn but youre not going to be changing the displacement of the carrier by blowing up something above the waterline. Feel like if modified zebra is set underway properly and you have a decent crew to set full zebra if something was happening it would be pretty hard to actually sink a carrier.","neutral","0.6023379564285278"
"Click here to message OP The comments on all posts are now locked due to spam, selling, and PM me comments. We do not lock the comments on posts with the Meta tag, so if you want to make a post discussing the state of the subreddit please post with the Meta tag. Example Meta Can we please lock the comments? I am a bot, and this action was performed automatically. Please contact the moderators of this subredditmessagecompose?to if you have any questions or concerns.","neutral","0.763188362121582"
"The condition says within 1year so I assume Im not liable to pay them anything after that, I havent signed the contract so its best maybe to renegotiate these conditions","neutral","0.7050243616104126"
"Going to take a shot in the dark in a knife that wouldve been still quite popular, would fit your description I believe, and be in the price range you describe","approval","0.6185340881347656"
"Come here motivator. School circle real quick and look me in the eye, and give me as honest as an answer as you can give me. From a Marine to a future Marine, tell me. Why do you think its a good idea to participate in a 3 month long training cycle, of one of the most difficult, physically straining and mentally draining professional military basic training courses in the US military, if you dont meet the bare minimum basic physical requirements?","curiosity","0.6814848780632019"
"FFS sorry to hear that GME has been targeted for the next rug pull by the lamest douchebags in the world. Every sub is bombed with bot posts about how cool felon, dump, and kfc jr are... you know its gonna be the grift of a lifetime, again.","remorse","0.5999475717544556"
"What frustrates me is that Hugh Jackman is a BROADWAY STAR. shocked He couldve sounded good if he hadnt been pushed to hit notes way outside his range and kept working while dehydrated for days. I get that they wanted a big-name actor with film experience, but since theyd already picked Jackman, they really shouldnt have put him in the wrong vocal spot like that.","annoyance","0.4816770553588867"
"post was removed for being way too long. Please put the question in the title and use the body to give context if necessary. Keep it succint. Dont post your life story, dont post a wall of text, dont post a novel. Current character limit is 300 characters. Do feel free to repost within the guidlines given above. I am a bot, and this action was performed automatically. Please contact the moderators of this subredditmessagecompose?to if you have any questions or concerns.","neutral","0.7093948721885681"
"So, I didnt make up the term module fragment. I just got the concepts mixed up. Module fragments actually refer to vertical sections of the module within the same file e.g. the global fragment where you can do includes and other preprocessor things. So, you were right to identify that. I dont want to confuse others with my word salad.","approval","0.36217570304870605"
"Not the best idea. I did the math - if that thing was invested in the SP 500 using the Compound Annual Growth Rate CAGR of 11.46, it would be 74,115.39 today. As a rule of thumb, dont hold onto bills.","disapproval","0.658531665802002"
"Q1. Someone I know has gone from average Joe to a billionaire in less than 10 years and it doesnt look like hes slowing down. I was thinking when is it enough and you decide to stop trying to make more money and just enjoy it. I known you would still need a purpose in life still,so perhaps his purpose is getting richer and richer and thats what hell always keep going. But money isnt everything. When I lost my job a few years back my GF 45 and I 50 decided we would forgo the 70k i would be earning so could focus on our passion which is our rural property. Can you identify with his situation and comment? Q2. The way i know him is that a mutual friend asked me to meet him and give him some guidance on how he can make a business he was starting successful. I spent a couple of hours with him and suggested he run things in a very differently than he planned. Gave him some advice about the best way to market hos business and ways to get around some barriers. He obviously evolved those suggestions tremendously, but its the ideas I gave him that are the reason the business became what it is. I would never ask to be remunerated for what I did. But Ill admit its not great thinking about his dozen or so supercars and millionaire lifestyle knowing he used my ideas to get it. Im not pissed off or anything, I gladly gave him some advice free of charge no strings attached. BUT the model is now being copied by a heaps of businesses and Ive got an opportunity to perhaps roll out a non completing version myself. My question is, would it be reasonable to get in touch with him and ask for what I gave him, a couple of hours of his time in the hope he can help fast track our success? Ie. Is a billionaires two hours not equivalent to the two hours I gave him 9 years ago? Sorry that was way longer than I expected.. I should have got your answer to the second question first.","curiosity","0.28014564514160156"
"Just tell the truth. You dont want to have any hard questions or comments that will hurt your feelings. This is a pattern of behavior for the city council. They try to block out any view point that is counter to their own.","neutral","0.6629638075828552"
"Also, countries. These are rouge jihadists in the sahel and west Africa who have been trying to create a caliphate since the early 2010s they have been doing this you have stories from many Christians and traditionalist in these areas having to flee cause of massacres and sharia. This is an extremist problem, not an Americanisreal problem.","neutral","0.7953879833221436"
"and 8 turnovers with a literal 0 plus minus. it was sloppy but ill wave it off with the third stringers and the ball literally bouncing off the back of vandos head bigger issue for me so far this season is ayton in the paint. he almost always brings the ball down, catch and go up with it big fella","neutral","0.4169076979160309"
"Im not missing your point I just dont agree. Having a bigger fandom doesnt make it more unique, it makes it more popular. And there are loads of fandom that combine all of this, at last to the degree worm is unique. I mean do you count every popular web novel in this group too?","disapproval","0.7675371170043945"
"i think she might be a girl, she doesnt exactly have that super bright mask that boys tend to have. Im not 100 certain but it feels right if shes a year old. Are these photos from a week ago?","confusion","0.8811457753181458"
"I just bought a few, because I am a fan of umbrellas from Fulton. Their website looks a bit sus, but they came through! Lots of different types to choose from and they are holding up well so far!","admiration","0.41173845529556274"
"I think the big N logo would only look proportionately better on sizes that are on the larger range of those that use the smaller N so basically like 88.5. Anything smaller than 88.5, Id say the small N logo looks better and more proportionate. I wear a 7.58, and Im sure 7.5 would look okay with the big N logo too, but I also have a couple pairs in size 7, and when you start getting down to 25 cm or shorter for those smaller sizes, the big N logos would start to look massive and disproportionate for a 992. This discussion and my perspective also applies to the 993.","neutral","0.5054545402526855"
"Yes. This is a problem now so pervasive in society that its starting to create very serious second order problems. Basically we just need to make sure that we stop creating systems where there are multi-milllion dollar incentives available for ignoring rules regs, and re-direct the course of culture that currently embraces the idea that rules regs lie on a spectrum from a corrupt conspiracy to a stupid inconvenience.","approval","0.5020896792411804"
"Every account is assigned a Contributor Quality Score CQS of highest, high, moderate, low, or lowest. Your current CQS is LOW. I am a bot, and this action was performed automatically. Please contact the moderators of this subredditmessagecompose?to if you have any questions or concerns.","neutral","0.7817160487174988"
"Oh, in addition, he recently bought a Strix Halo laptop and he said its better than any mobile Intel available. That is, just Strix Halo architecture. Zen 5 arch is the same or might be worse than the Arrow Lake arch","neutral","0.9099056124687195"
"Yo i have the same problem rn how did you solve that or the only option is to re apply for it cus no way Ill be able to go to rto again since its way too far","neutral","0.5240782499313354"
"I have very much tried. He doesnt even react. He doesnt fight about it he listens to what I have to say with a blank expression and then never does anything about it. I also tried to ask if I can do anything with no response, I have asked to talk about it in therapy but he didnt really speak when we did. I am very open and honest, Im a vocal communicative person and with sex I am not shy at all. But he is beyond prude, like he simply shuts down about it. The most reaction I ever got was when I suggested pills maybe to help him last longer to give me a chance to enjoy it and he seriously blew up. So I dunno","neutral","0.5871948599815369"
"Oh noo I dont use my loofah on my vulva oh Id never I just meant like if Im washing my thighs and it accidentally touches it, throw it away or is it fine? Im making an appointment for him tomorrow to get tested for it. I was going to wait until my test came back but since he could have it and not know its best to make 100 sure. If the test comes back positive I will probably ask for daily medication. The ob i possibly have really isnt that bad, like its a bit uncomfortable, but I surely dont want to deal with this on a regular basis. And thank you for answering so many of my questions! I appreciate you.","gratitude","0.8236421942710876"
"I forgot poeple let white men like him slide. forget he dated a 17yo when he was 38. who cares, he is a rich funny white man. He hates the woke and supports isreal. and amazing guy.","admiration","0.8404752016067505"
"I was just reading that the semi-open bag style is trending. Im not a fan, it looks like your bag is falling open and is an invitation for pickpockets if you live in a city. Im thinking this trend will be short-lived - security is important.","neutral","0.5250108242034912"
"Unintensionally many times harsh words do come out , which i never mean in real , but it just comes out . Trying since many years to have a control over it , still unable to achieve it","disappointment","0.6430128216743469"
"also, I bought a MulderDuchovney ken doll back when it was available to be Adam Hauptman, and a Crystal King to be Z in fae form though he would need a repaint","neutral","0.8889811038970947"
"Warning uephanryan read the below to avoid being scammed Only trade with someone that comments on your post, open your post and confirm the comment is visible. Banned users cannot comment, but may PM you and attempt to make it look like a public comment. Do not trade with green colored usernames or anyone having r before their name - these are subreddits made by scammers to trick traders. Search your trading partner on the Universal Scammer List USL. Known serial scammers, ignore and block etInllNnmllIlIll1918 !!! loneoInlinoneIlonone !!! IllbilItiliselI or any similar looking name smargo !!! Snes91 !!! Bjfoster !!! Serenadings !!! dgollert101 Click here to learn how to confirm transactions, leave feedback, and increase your flair score. I am a bot, and this action was performed automatically. Please contact the moderators of this subredditmessagecompose?to if you have any questions or concerns.","neutral","0.8485174179077148"
