"comment","harmful_label","score"
"Need mo ng patience hahaha one cat lang ung pinakapon ko pero grabe ung stress na na-exp ko hahahaha thankful ako sa kapatid ko kasi tinutulungan nya ko alagaan ung pusa ko. Magpapainom ng meds, apply cream, alalay sa pag-ihi at inom, pagbabantay kung nadidilaan na ba ung sugat. Very important ung cone, marami kaming cone na binili kasi natatanggal nya talaga hanggang sa nahanap namin ung best cone hahahaha tapos nagsuggest din sila na tofu litter ung gamitin nila para magpoop or ihi. Late na namin to nalaman pero buti na lang din di dinidikit ng pusa ko ung butt nya sa sand so di na-infect sugat nya. Usually 1 week lang recovery period sa male cats daw pero me umabot ng two weeks just to make sure na dry na ung sugat. Sobrang maaawa ka sa kanila kasi umiiyak sila pag di sanay sa cone, di nakakapag-groom tho binibigyan namin ng break sa cone para makapag-groom tapos binabalik na namin pag didilaan na ung sugat. Mas magandang naka-cage sila para minimal movements or sa maliit na kwarto na di sila makakatalon. Ayon since two cats yan, much better if may kasama ka na tutulong sayo.","amusement","0.8533124327659607"
"voh toh theek h no offense but they see the rank for a reason because depending on the role u need to be really good at maths like exceptionally good, my friend got shortlisted too but he said during the interview he was sweating hard solving problems for 50-60mins lol","amusement","0.7644657492637634"
"Yes the jet ''sucks'' because you cant get a match ?? Skill issue, if you expect a plane that do everything dont play like 99 of the planes in game","annoyance","0.4714074432849884"
"Welcome to rJerkOffChat! Stay safe 18 Dont share personal info, use anonymousencrypted accounts, avoid facetattoosidentifiers, set boundaries, and stop if pressured. Helpful links Browse or create a Safe Sexting Bot set up a private bot for safer, anonymous sexting. StopSextortion.com guidance and resources if youre threatened or blackmailed. Related subs 18 Please follow all rules and local laws. Note These resources are shared by users we cant independently verify every link. I am a bot, and this action was performed automatically. Please contact the moderators of this subredditmessagecompose?to if you have any questions or concerns.","caring","0.661939263343811"
"So I see what youre saying and I think youre right that a lot of the behavior is online. I will say that Im starting to see the online behavior leak into the real world. Its still a minority of people, but it is real. People are being influenced by the online activity.","approval","0.7709798812866211"
"100, I dont plan on giving them a bulk sum of money without them being financially literate. I plan on teaching them about finances and investing, which sadly I never got that wisdom early on.","sadness","0.7319549322128296"
"Sua postagemcomentário está em desacordo com a Regra da comunidade Motivo Conteúdo nocivo à comunidade SPAM, propaganda, desinformação, golpes. Saiba mais 1. !O Reddit combate o SPAM intensamente.! 1. !Seus filtros suspendem indefinidamente, contas suspeitas de spam, resultando num shadowban. Elas seguem ativas, mas suas interações ficam invisíveis aos outros.! 2. !Para normalizar sua conta, por favor, leia o guia da comunidade sobre shadow ban 3. !Entre em contato com a moderação caso tenha dúvidas.! 2. !Não é permitido promover produtos ou serviços nesta comunidade.! 3. !Postagens com golpes ou desinformação serão removidas.!","neutral","0.9259655475616455"
"The last company I worked for was like this. Only about 12 people in the company and the boss was always saying Well Google does this and Google does that. I would get mad like.. how about we blaze our own path? We sell curtains!","neutral","0.7498515248298645"
"i see a lot of people in public servers putting 8 brontos when hatching eggs. one time, i checked a guys garden with 8 brontos but when i checked their stats, he only needed the 3 brontos 11, 9, 10. i told him if he wanted to trade his brontos for my kois andostriches for more use of his pet slots, but i guess he took it as an offense, started trash talking me for no reason, and left lol.","amusement","0.7517899870872498"
"I mean yes but we just barely found that out, and its just a theory. But even basic everyday shit like why do we yawn? Scientists have no clue, there is theories like were trying to cool our brain down which sounds dumb to me","annoyance","0.5042240619659424"
"You mean the latest masterpiece of fantasy storytelling from Lucasfilms Brian Moriarty? Why its an extraordinary adventure with an interface of magic, stunning high-resolution, 3D landscapes, sophisticated score and musical effects. Not to mention the detailed animation and special effects, elegant point 'n' click control of characters, objects, and magic spells. Beat the rush! Go out and buy Loom today!","curiosity","0.32874542474746704"
"Back in 2008, Putin couldnt legally run for a third term, so he had Medvedev take the presidency while he slid into the prime minister spot. Later, he pushed a change to make presidential terms six years instead of four. Then in 2020, he reset his own term limits, clearing the way to stay in power until 2036. His 2024 win with 87 of the vote? Most observers say that number is statistically impossible. Sounds like what Trump is trying to do, Russifying the US.","neutral","0.6966061592102051"
"Impressive_Heron_316, please check the sidebar for the rules of this sub! If this post violates the rules, PLEASE check and report this post! Recommended Subs -- rOffMyChestUnfiltered rWhatMenDontSay rAskMenRelationships Automoderator has recorded your post to prevent repeat posts. Your post has NOT been removed. Impressive_Heron_316 originally posted Dating this guy who said at a point he enjoyed being nonchalantmysterious but didnt really say why. I find it annoying, I try to ask questions about his activitiesdays and hes pretty short and difficult to talk to. He seems very aware of it though which gives me the impression its an act to keep us from getting serious. Its literally only been a few weeks of talking and like two dates so I cant tell for sure yet but he also just threw the I dont like texting much. Which is also fine if thats really the case as I also hate texting but is he just trying to get sex? We were unable to have sex the first two dates so not sure if hes expecting on the third but with this behavior I dont even want to. Could it be possible hes nervous and inexperienced with dating and thinks this will win me over or is he likely a player that is using the act to show he only wants sex? I am a bot, and this action was performed automatically. Please contact the moderators of this subredditmessagecompose?to if you have any questions or concerns.","confusion","0.3684728443622589"
"You can only wear the old uniform if you didnt have all the pieces for the new one, at this point it would have to be approved by a supervisor. There wasnt a time where you could wear a mix, either all old or all new. The only time Ive seen people with the old uniform in the last couple of months was for maternity","neutral","0.7982823252677917"
"She has almost 30k subs on yt now. I am not active on twitch anymore. But she actively participates in so many MCCs and collaborated with large MCYTubers like Inthelittlewood or ldshadowlady","neutral","0.9128893613815308"
"Well you said yourself that it might not make a profit, and demanding that a band do something like that that takes so much time and money and coordination because they theoretically have the money to pay for it would just be rude and entitled. Brendon has a family and stopped touring because his priorities are with his wife and child - maybe he wants to put his money towards his kid and not a youtube video?","neutral","0.7109622359275818"
"Remember to check our discord where you can get faster responses! I am a bot, and this action was performed automatically. Please contact the moderators of this subredditmessagecompose?to if you have any questions or concerns.","neutral","0.521149218082428"
"Both are good people by heart we can see that in the show, but who is better we cant say that because ashnoor had a very safe and happy childhood and treated as a princess by her parents, she never learned to raise voice or may be cursing because she doesnt needed that in her life, her parents were there protecting her, when it comes to farhana she fought her way to reach this stage, when people fought their way through suppression they will pickup some bad things along the line like raising voice and cursing as an armour or weapons, we cant judge on that, we should judge on her intentions, she is genuinely a good hearted person.","admiration","0.5171599984169006"
"I would argue the Sega and esp N64 are the odd ones here for a unique layout combined with more buttons than usual. At least they share the 6 right hand buttons but the Z trigger of N64 is very special. All others are well","neutral","0.5556700229644775"
"They work hard, but not nearly as hard as we do. Its why we are the ones trusted to cut people open and they are the medicsnurseswhatever else. Not to mention they carry next to no responsibility compared to us.. I never said you dont matter..","neutral","0.707610011100769"
"oh no he bled one time in a professional fight where it was very competitive for the first round against another fighter whos punching him in the face, in the biggest test of his career so far. Yeah hes definitely quitting!!!1!!!","neutral","0.35431572794914246"
"My cousin was on MAFS, I wont say who he was but we all told him he was crazy to go on it. He had a girlfriend of 3 months when he got the call he was going on. He told us he wanted to lift his profile because he had a business he needed to get promoted. He was trashed on MAFS, but it actually did lift his business profile. We thought his life would be over, but it had a positive impact on his business and when I say he was trashed, he was TRASHED!! So maybe the old adage any publicity is good publicity is true.","neutral","0.5986871719360352"
"Borg and Sampras should be above Carlos as they currently stand but I dont get people in these comments saying this sub has recency bias!!! when this sub didnt compile the list, Roddick did. Go beef with him lol.","amusement","0.8257150650024414"
"Will they be held accountable? I sure hope so. ICE isnt acting as law enforcement. Theyre just uniformed, face covering cowardly thugs that should be put in jail with the harshest sentences.","optimism","0.6414657235145569"
"Honestly they just need to refund the money you paid and end the relationship. Or you could just bring that up. Refund what I paid and done. You keep the sick cat etc etc You know returning that cat to them is bad news bears for that kitten.","neutral","0.8520218729972839"
"Yeah it needs it badly, game is so boring queuing into a lottery machine and getting the worst character matchup out of all the characters I have chosen I play less deadlock everyday because its just so boring because of it.","annoyance","0.573792040348053"
"La qualité des tours est assez variable effectivement. Les tours de la villa dEste ont assez mauvaise réputation pour ça. Je suis dans une tour côté avenue dItalie et lisolation est globalement bonne. Je nentends pas les voisins coloc détudiants et on est plutôt bien isolé DPE C.","neutral","0.9352800250053406"
"Your comment has been removed on because you do not meet the user requirements to post or comment. You do not have enough comment karma 10 or account age 10 days. Both conditions must be met. Please read the sub rules at the top of our main page for full posting and commenting guidelines. I am a bot, and this action was performed automatically. Please contact the moderators of this subredditmessagecompose?to if you have any questions or concerns.","neutral","0.7695571184158325"
"This dude is a fucking freak of nature. I dont even like baseball but watching this dude just blows me away. Its not even fair. He makes the best pitchers in the world look like fucking amateurs. If someone told me a pitcher would be a dominant hitter a decade or so ago I wouldnt believe them","admiration","0.37159818410873413"
"My guess is a Terrible Twos episode. My autistic 4 year old is specifically obsessed with the first half of the first season but Ive seen way more than that in the past. But for some reason 9 really freaks him out 8 sometimes too, I think because its when 9 sneezes out a 1 and becomes 8 that he really freaks out","neutral","0.43862250447273254"
"Reddit Türk İttifakı rTurkeyMeta rSekulermilliyetciturk rTiele I am a bot, and this action was performed automatically. Please contact the moderators of this subredditmessagecompose?to if you have any questions or concerns.","neutral","0.7549790143966675"
"You think its early ? Damn I feel like its a long time lol . I think maybe its because Im desperate to get back to my body and self","amusement","0.8553706407546997"
"Be a Greg and ensure your submission follows the rules and is flaired appropriately! If your submission violates the rules or isnt correctly flaired, it might be removed at the discretion of a mod. Please make sure that if you bring a post inquiry to modmail, you link the post in question, as we are unable to help those who do not link the post. This comment is an automatic reminder and you are not in trouble, it is posted on every submission to the subreddit. I am a bot, and this action was performed automatically. Please contact the moderators of this subredditmessagecompose?to if you have any questions or concerns.","neutral","0.5796168446540833"
"This video seems stage. Like what went through his head? Hey that looks like my lost dog, let me pull my phone out and start recording before I approach him? If I saw my lost dog, the first thing is my head is to sprint to him and not let me pull my phone out first and start recording just in case","neutral","0.5110487341880798"
"Ive had many people tell me that. Idk I just cant wrap my head around eating a duck. I dont even like thinking about that Im eating a chicken laugh","amusement","0.570671796798706"
"Welcome to rWatchesIndia Please be civil. Please report abusesvulgarity. If youre looking for a Mod or Custom watch, DM utanay2043 You may take sales posts to rWatchesIndiaExchange. I am a bot, and this action was performed automatically. Please contact the moderators of this subredditmessagecompose?to if you have any questions or concerns.","neutral","0.4797797203063965"
"Ran into this problem today and another post in another thread mentioned using an extension and getting low to get underneath. It worked for me. But, only spraying from the right side of the scissor lift where right is if youre facing the screen","neutral","0.8831549286842346"
"I cant help but wonder if Im doing anything wrong with that case. I have that case and the airflow situation from the front intake isnt any good. The HDDs at the front require higher static pressure fans to push air through the 11 hdd caddys. It says it has a mount for the optical drive, but no proper place to screw it in for support. The case has been with me for 3 years and now the front intake mesh has started to rust and crumble. Have they changed the quality or design in any way for it to be suggested over the other cases? PS I looked for the thread but I cannot find which one exactly youre talking about, the one where it was about someone asking for a case suggestion?","curiosity","0.5004051923751831"
"All honesty, someone on here posted a quote that makes Boomers make so much sense, and now I cant unsee it. Its not enough to win. Someone else has to lose.","disappointment","0.4229150414466858"
"First, the illegal invasion of Ukraine. The highest russian leadership, putin, denies Ukrainian nationhood. Deliberate targeting of civilians, proven by double tap attacks on first responders and drone footage. Using rape as a weapon against their own troops too, so have fun when you get sent. Kidnapping of Ukrainian children and russifying them in camps, the order to do which comes from russian leadership ICC wanted criminals putin and maria lvova-belova. Russia displays clear intent of genocide against Ukrainian people.","joy","0.33979901671409607"
"I dont think, but rather I know, because I paid attention in civics class, and because Ive paid attention throughout my life to our municipal governments, that the chief executive of a government has a great deal of authority over policy, and can play a major role in directing legislation. For that reason, if we want major reform, we have to elect an executive and a legislature who will work in tandem to implement the relevant reforms. Gee, I wonder whats about to happen on the Seattle and Bellevue ballots this coming week.","surprise","0.45117706060409546"
"Double hoodwinked. The free refi is them baking costs into the rate. Dont fall for the gimmick go find someone who isnt selling shiny stuff and you can get 5.875-6 all day long.","neutral","0.9013087749481201"
"Dont dread too hard. This is more like chronic illness now, that you will have to go through treatment but life will return to normal, albeit a little adjusted. I was 40 at diagnosis, with kids 13 and 8. I had a surgery, chemo last year, am now on double hormone blocker therapy and had another surgery corrective, so not strictly necessary. I ride my horse, do strength training, worked full time through, everything is almost normal, except my hair refuses to grow, haha. I gained weight last year, lost it all back to normal now. As much as it felt like the ground was slipping from under me, when I was diagnosed - I have now emerged on the other side. Wiser, if anything. You can do this. Dont let it consume more of your life than it has to. Being very fit helps you a lot, because you will recover from everything more smoothly","amusement","0.42464572191238403"
"All the season 3 POIs and mythics, was such a fun season. Also had the best story of the season, or at least I enjoyed it the most. So many fun weapons this chapter too, especially this last season. Wrecker, Collateral Damage AR, minigun, air strikes, the Mortal Kombat mythics, all the crazy blasters in the Star Wars mini-season.","joy","0.8549501895904541"
"OP, please reply to the correct answer with solved! include the ! Additionally, use our Spotlight feature by tappingclicking on the three dots and selecting Spotlight, Pin this comment in order to highlight it for other members. Thanks for using our friendly Automod! I am a bot, and this action was performed automatically. Please contact the moderators of this subredditmessagecompose?to if you have any questions or concerns.","gratitude","0.9252219200134277"
"No, do not feel guilty for leaving him. You need to get a divorce. Making an AI generated nude of another girl not just any girl, but one he is best friends with who he also had a crush on at one point while being married is crazy. He generated that image for a reason, and its because hes sexually attracted to her. Your husband should only be sexually attracted to you. Leave him and dont look back.","neutral","0.42201605439186096"
"As a freelancer, Yes. And when it comes to my money as an expat, i always keep track of my finances and taxes. It helps during tax fillings. Reduces dependency on an accountant as well. I do it- -Manually best in some way -With platforms or apps specific to a country free ones are available such as mint, gnucash, irs2go -In case of different currencies, use cross country platforms ones such as settel .io","approval","0.6416597366333008"
"No joke, I did a lot of calisthenics and could some cool stuff a while ago but my back and shoulders are not ok anymore. The pain is forever cry","sadness","0.808275580406189"
"Its hilarious to me that he thinks his life would be better if he was with a supermodel. Not only is he an asshole but hes also an idiot. Just leave him","amusement","0.8128255605697632"
"Shes the voice in my head when I go to the store and cant find shit but its like FUCK THEM SIGNS! THAT BITCH RIGHT THERE KNOWS WHERE EVERY DAMN THING IS AND WE CAN GET THE FUCK OUT OF THIS GOD AWFUL HELL HOLE AND AWAY FROM ALL THESE FUCKING PEOPLE. Then I ask and theyre like Sir Im just a vendor, I dont actually work here. So I kick the ladder out from under them and throw their whole crate of fucking wonderbread on their stupid fucking face and steal their fuckin twinkies. Then I snap out of it and apologize to the grandma whos cart Im blocking because I thought the corner of the fucking building was well out of everyones way for me to have my inner tantrum. Wrong. Can someone explain to me please how I am ALWAYS in some-fucking-bodys way at the store? Wheres the safe spot for husbands and fathers to stand while their wife and kids raid the isle and bring back the loot?","anger","0.7438960075378418"
"Your first thought should be to get a proper brick and mortar bank account so you can talk to people and not AI bots. Real banks dont restrict access to accounts without solid legal evidence of fraud, money laundering or criminal activity. Please take this as a wake up call to move your funds to a real bank. Revolut is fine for travel money and as a backup online-only account, but for anything else it can be an unmitigated disaster. Please learn from this experience and warn any friends that have all their money in online-only banks.","neutral","0.39958682656288147"
"Its not bad, but you still kind just twist up and lift on the backswing and then shovel through instead of actually coiling back. Get a lesson and ask about that","neutral","0.7239572405815125"
"Obviously i abandoned hope for the industry And for your information, Im in a psychology major at one of the top universities in the world. So your last sentence doesnt mean shit and it doesnt make u smarter than anyone","disapproval","0.33363595604896545"
"Hur menar du när du säger rent känslomässigt? Att utvisa en person som begått ett grovt brott minskar risken att liknande brott sker i framtiden. Är inte det mest logiska då att utvisa personen?","neutral","0.6441397666931152"
"You appear to lack a flair. Here is a guide for new reddit a guide for old reddit and a guide for mobile reddit If you cannot locate your age and gender, please message us asking for the correct gender flair. Please also specify if you want your age to go with it as well. Thanks! I am a bot, and this action was performed automatically. Please contact the moderators of this subredditmessagecompose?to if you have any questions or concerns.","gratitude","0.9381259679794312"
"Yeah, was actually cold inside on the second night. The balance of the lineups were off or it shouldve been a different venue I guess. Really pleased I got to see MLIW and HWM as Ive never seen either band before.","joy","0.5879154205322266"
"You have no idea what power does our clg holds its not like some random bjw clg trust me Ive experienced first hand , I was like these guys are gundas disguised in formals and blazers.","neutral","0.7550063729286194"
"Could argue having a amakusa to replace one of the hi nus but basically this. But I have a theory, if you suck or lack a meta supportraid just gen stack, if one of the gens has good range and or data link its a plus No point being a crummy raid and getting chat spammed or being support and being bullied because your team doesnt care about you you cant assert yourself","neutral","0.7737761735916138"
"I tell you, this deserves an anime adaptation with a good studio. Watching the kids made me feel like a proud parent. Way better than whatever the hell is nano machine.","admiration","0.770013689994812"
"Your submission has been removed due to a title commonly associated with spam. Please review our title guidelines. - I am a bot, and this action was performed automatically. Please contact the moderators of this subredditmessagecompose?to if you have any questions or concerns.","neutral","0.6365358233451843"
"The way hes going about this is messed up. This is clearly not a conversation. It seems like hes just diminishing you and not really listening. Its ok that you fucked up he shouldnt be treating you like this. Also, are you both young? I only ask because it sounds similar to a way a teenage couple might talk, and might shed some light on how hes reacting","annoyance","0.471692830324173"
"Welcome to rJerkOffOnCam! Stay safe 18 Dont share personal info, use anonymousencrypted accounts, avoid facetattoosidentifiers, set boundaries, and stop if pressured. Helpful links Browse or create a Safe Sexting Bot set up a private bot for safer, anonymous sexting. StopSextortion.com guidance and resources if youre threatened or blackmailed. Related subs 18 Please follow all rules and local laws. Note These resources are shared by users we cant independently verify every link. I am a bot, and this action was performed automatically. Please contact the moderators of this subredditmessagecompose?to if you have any questions or concerns.","caring","0.6501339673995972"
"Once again, same answer as a similar poll about abortion on this sub, its not awesome, nor is it bad. It is AMORAL. It is neither morally correct nor incorrect, it just simply is, and is sometimes required to save the mothers life.","approval","0.57766193151474"
"Maye is way better in his second season than a lot of QBs who came before him. Josh Allen was still learning how to play QB at this point, hes way beyond that. Only Justin Herbert and Pat Mahomes looked this good this early.","neutral","0.7615494132041931"
