"comment","topic","topic_prob"
"someone know has gone from average joe billionaire less than years and doesnt look like hes slowing down was thinking when enough and you decide stop trying make more money and just enjoy known you would still need purpose life stillso perhaps his purpose getting richer and richer and thats what hell always keep going but money isnt everything when lost job few years back and decided would forgo the would earning could focus our passion which our rural property can you identify with his situation and comment the way know him that mutual friend asked meet him and give him some guidance how can make business was starting successful spent couple hours with him and suggested run things very differently than planned gave him some advice about the best way market hos business and ways get around some barriers obviously evolved those suggestions tremendously but its the ideas gave him that are the reason the business became what would never ask remunerated for what did but ill admit its not great thinking about his dozen supercars and millionaire lifestyle knowing used ideas get not pissed off anything gladly gave him some advice free charge strings attached but the model now being copied heaps businesses and ive got opportunity perhaps roll out non completing version myself question would reasonable get touch with him and ask for what gave him couple hours his time the hope can help fast track our success billionaires two hours not equivalent the two hours gave him years ago sorry that was way longer than expected should have got your answer the second question first","0","0.4826533794403076"
"also countries these are rouge jihadists the sahel and west africa who have been trying create caliphate since the early they have been doing this you have stories from many christians and traditionalist these areas having flee cause massacres and sharia this extremist problem not americanisreal problem","0","0.14049410820007324"
"and turnovers with literal plus minus was sloppy but ill wave off with the third stringers and the ball literally bouncing off the back vandos head bigger issue for far this season ayton the paint almost always brings the ball down catch and with big fella","2","0.301334023475647"
"not missing your point just dont agree having bigger fandom doesnt make more unique makes more popular and there are loads fandom that combine all this last the degree worm unique mean you count every popular web novel this group too","2","0.3061443269252777"
"think the big logo would only look proportionately better sizes that are the larger range those that use the smaller basically like anything smaller than say the small logo looks better and more proportionate wear and sure would look okay with the big logo too but also have couple pairs size and when you start getting down shorter for those smaller sizes the big logos would start look massive and disproportionate for this discussion and perspective also applies the","0","0.14842888712882996"
"yes this problem now pervasive society that its starting create very serious second order problems basically just need make sure that stop creating systems where there are multimilllion dollar incentives available for ignoring rules regs and redirect the course culture that currently embraces the idea that rules regs lie spectrum from corrupt conspiracy stupid inconvenience","2","0.32763952016830444"
"have very much tried doesnt even react doesnt fight about listens what have say with blank expression and then never does anything about also tried ask can anything with response have asked talk about therapy but didnt really speak when did very open and honest vocal communicative person and with sex not shy all but beyond prude like simply shuts down about the most reaction ever got was when suggested pills maybe help him last longer give chance enjoy and seriously blew dunno","2","0.27689433097839355"
"noo dont use loofah vulva never just meant like washing thighs and accidentally touches throw away fine making appointment for him tomorrow get tested for was going wait until test came back but since could have and not know its best make sure the test comes back positive will probably ask for daily medication the possibly have really isnt that bad like its bit uncomfortable but surely dont want deal with this regular basis and thank you for answering many questions appreciate you","0","0.2918030321598053"
"warning uephanryan read the below avoid being scammed only trade with someone that comments your post open your post and confirm the comment visible banned users cannot comment but may you and attempt make look like public comment not trade with green colored usernames anyone having before their name these are subreddits made scammers trick traders search your trading partner the universal scammer list usl known serial scammers ignore and block etinllnnmllilill loneoinlinoneilonone illbilitiliseli any similar looking name smargo snes bjfoster serenadings dgollert click here learn how confirm transactions leave feedback and increase your flair score bot and this action was performed automatically please contact the moderators this subredditmessagecomposetorgiftcardexchange you have any questions concerns","1","0.746425986289978"
"sorry but strict carnivore diet absolutely not known cure gout the exact opposite has been proven excess amounts meat especially red meats and organ meats increase uric acid the blood which then forms crystals the joints commonly known gout check your serum uric acid regularly and suspicious any joint complaints take care","0","0.10417716950178146"
"well yeah argument was taking bad operators classes with broken ones say that the class can weak despite them their argument was taking broken operator class with plenty bad ones say the class cant considered weak because them point was also that the class hardly means anything for the power level they want sell character bad class theyll just put something into their kit that allows them ignore the bad parts the class entirely just have them not play like the class supposed all kaltsit and reed alter are medics being executor specialist didnt save crownslayer from being bad despite the class being inherently strong just like being vanguard not guarantee character will good because ines exists","2","0.5431674718856812"
"terms aesthetic has its own unique look and the only way approximate that look either train your own lora qwen flux chroma find one that somebody has uploaded civitai tensor art various other similar model hosting sites terms being creative the best open weight one probably chroma but takes some effort learn prompt for properly","0","0.30810970067977905"
"this can relate its not deal breaker they dont though just fear that get into relationship going forward that might feel alone that makes sense cheated and didnt talk her for over year she sent text asking how was doing and opened about issues with incontinence and she mentioned shed wear diapers along side make feel comfortable had been together not that want her back anything but felt nice knowing that she didnt look differently and things had been different would have went that far make feel good but being single and not knowing will meet another theyd accept the least understanding the result will rejection","2","0.3327975869178772"
"ive used roku devices since and roku doesnt buffer unless theres some kind internet issue source issue mostly watch philo netflix paramount hulu disney peacock prime video tubi and plex and currently using roku express roku streaming stick and roku streaming stick devices tvs parents mostly watch yttv youtube prime video and currently use roku ultra devices their tvs one sons uses firestick and dont think has buffering issues either but the firestick doesnt seem polished roku least","0","0.24641239643096924"
"bennnk pontosan ilyen rzsek keringtek sok ktely pedig indultunk neki hogy gyereket szeretnnk kellett tisztznom magamban mit vlasszak egy kpet ami azeltt fejemben hogy tudtam volna milyen anynak lenni vagy elengedni ezt nagy valsznsggel hrman maradunk mert anyaknt szintn azt vallom csak olyan helyre kellene gyereknek szletni ahol jelenben mindkt szl vgyik elvrsoktl csaldtmogatstl szlsg eltti vgyaktl fggetlenl","0","0.22721458971500397"
"minutes wouldnt enough your drying clothes inside course cools the house down how wouldnt cool the house unless was warmer outside than dehumidifiers use tiny amount electricity you need reevaluate how invested you are what other people something trivial makes you sick its honestly bit pathetic","0","0.1911701261997223"
"retreading very common practice the you cannot retread steer tire legally but you can retread steers drive tires and drives can retreaded for use drives again trailer tires once retreaded tore can retreaded second time for use trailer the casing still good all the casings were xray tested before being retreaded and had the option get our own casings back didnt mind the wait could exchange for ready recased tires core exchange system with tires the truck trailer combo tri axle trailer there was significant savings retreading especially for the trailer since those tires are under less stress only had one casing fail exchange casing instead one had custody from new and failed immediately inflation didnt make the road over all would save its very economical system","2","0.2817419469356537"
"one claiming that current law would mean sexual harassment claim blocks deportation but thank you for answering the question that you would like that way how would deporting someone back their home country human trafficking she should have path whatsoever citizenship ever she broke the law come this country should not reward people for breaking the law deporting her should not stop the investigation into the crimes shes alleging","0","0.2549939751625061"
"bro sent half kendama the stand purposely got those ben baller ones bulk asffff for stupid cheap well jumper cant sell that shit anymore its years old send the stand bruh and say made right only after won hoodie lord know ima get either item like ima pay for shipping that you fucked bitch youuu eat that cost now you got full refund and didnt even request refund just let them know that devon told hed make right lets wait see and they still send back they for brand new onl the website from the freshest drops lord knows ima get one from even get one all wanted pay for shipping make his mistake right things people will just accept defeat dead ass have been the phone with lawyers about this app and the way that what not does shit people who bring them thousands month fees alone cant stand the corporate greed and the deceit the thing will pay for and amazing luck sent both the free hoodie and the kendamanever sent the message feel like uses that label send only the kendama will keep you updated tomorrow tuesday what pos lost the kendama got directly from jumper this was replacing and was exetatic had just seen the damn thing put for live bid and won the auction for hes getting star review even sent bape cant fuck himself and enjoy hell because the theft and how get over anyone possibly can slip into when hes losing money sell everything your store full price buddy you cant sell that much that fast its impossible you take the loss price and just reup for more the bitch made west coast white boy would make way more money the end was honest every time theres way theres this much shit being said and its alllll some bullshit regardless someone spent nothing the legal binding contract states you cant discriminate due this bot ass account can understand honestly but why isnt whatnot doing something about the bots blame them dont try and make take loses literally the same day sent this hoodie out with the kenda whatnot refunded had already sent them all the proof and sure some sellers are shit and lie like didnt gettt whole time they did its like the bad apples ruin for all this guy should have been banned from this platform try that ebay auctions theyd kick his ass the curb fast","2","0.42771708965301514"
"click the link above see community curated list home maintenance products amazon that may help you out your current situation youve found the answer your question youve found this subreddit helpful buy beer bot and this action was performed automatically please contact the moderators this subredditmessagecomposetorhomemaintenance you have any questions concerns","1","0.4184023141860962"
"welcome rjerkoffchat stay safe dont share personal info use anonymousencrypted accounts avoid facetattoosidentifiers set boundaries and stop pressured helpful links browse create safe sexting bot set private bot for safer anonymous sexting stopsextortioncom guidance and resources youre threatened blackmailed related subs rgoonedmeetup rsnapchatbuds rjerkinginstruction rjerkoffoncam please follow all rules and local laws note these resources are shared users cant independently verify every link bot and this action was performed automatically please contact the moderators this subredditmessagecomposetorjerkoffchat you have any questions concerns","1","0.8043125867843628"
"welcome raskbaking are happy have you please remember read the rules and make sure your post meets all the requirements posts comments that not follow the rules will removed bot and this action was performed automatically please contact the moderators this subredditmessagecomposetoraskbaking you have any questions concerns","1","0.7715713977813721"
"get that but its still not someone whos representative the average american has been afforded opportunities most dont even think dream and theres nothing wrong with that but leader country prefer someone whos some point had the grind and didnt have safety net fall and got there their own wishful thinking know","2","0.2576448917388916"
"the power admit new states change state boundaries already outlined article section clause the constitution short and for the purposes how relates this discussion there cant any topdown redrawing state lines like youre advocating for such boundary changes must agreed upon locally the state legislatures themselves and then approved congress and talk people either the dakotas use your example and belittlingly explain them how they are basically the same state and are wasting electoral resources and that they really should and merge for the benefit everybody else","2","0.18318945169448853"
"best run with vlad have been trying hparmor run with beefy rings see what the scaling like had rings with maybe syringes and shrine dmg upgrade and ended with before using juice boost dmg think replaced the armor with dmg wouldve lasted longer was surviving swarmed hits all the way and then got one shot cry","2","0.3130379319190979"
"welcome uhunterreal quick reminder dont use your real name identifiable handles nsfw spaces stop and report they ask you for identifiable info pics helpful stopsextortion use anonymous tools for sexting make sure follow all rules here full rules thanks more fap material meet other gooners our new sub rgoonedmeetup and rjerkoffchat gif download links redditsave reddtube for this post bot and this action was performed automatically please contact the moderators this subredditmessagecomposetorgooned you have any questions concerns","1","0.7969026565551758"
"not really its like umpires call cricket where theres certain grey area where whatever the umpire decides the ground the decision that ahead with outside that grey area the technology gets decide the final decision works pretty well that sport least yeah some people moan about when decision doesnt their way but most people usually shrug and get with","2","0.3302515745162964"
"scientifically seen should started soon possible below age since the medication approved for that age but yes that age window the best though works very well all ages its about the gaba switch and you know that happens very early trying modulate that should also happen very early","0","0.14684481918811798"
"this exactly the result the failure patriarchy adequately run the show patriarchy failed miserably never said would pretty dont angry for acknowledging the reality mad the system that has destroyed much patriarchy has never been pretty has always been violent and horrific unjust destructive and rape filled there chance save anything going forward will not saved patriarchal rule you want quake and cry while others try save what remains you and cry then tragic your feelings patriarchy was always going fail miserably and here are the best can save what can and minimize suffering are able and plan for something better these failures are not repeated","2","0.3995777368545532"
"know that this going the most absurd trust bro thing youll read this website and dont expect anyone believe but someone who was once states witness very large federal fraud case and separate instance had deal with the stern family businesspolitical setting the stuff saying about texting fbi agent and sterns behavior likely more truthful than not","0","0.31630268692970276"
"looks like your post contains reference height your post asking about using nevilles techniques grow taller this subject has been covered several times the subreddit you must ask height related question please post the weekly otherwise post the weekly open discussion thread please review the subreddit rules thank you bot and this action was performed automatically please contact the moderators this subredditmessagecomposetornevillegoddard you have any questions concerns","1","0.4143451750278473"
"dno but the boys seemed like she had plan but most happened because the other unrelated things and she kinda got credit without doing too much genv seemed like she wanted godolkin follow her plan but when decided his own path she just ruined out spite which sad because seemed like godolkin would actually able become strong enough control homelander and could see very interesting power struggle the boys while his plan had lot holes was actually working much better than anticipated and not for polarity release would actually win far feel like the writers are trying too hard show her very smart but just dont feel but cant deny that the lore she actually smart and her plans are amazing thats more common writers problem where you cant genius but have write one and taking that consideration she the biggest threat homelander and unless kills her soon possible she will become the main character and win being the shady mastermind which kinda against the general plot the boys where have another team the main characters who should come with such plans nothing against her but far she does too much for the story and diminishes lot the other character decisions","2","0.49330586194992065"
"lmao this guys has these lies ready post seconds many people have addressed what you said the shares are not tradable any public exchange like robinhood but seriously you respond seconds with long responses its your job lower sentiment everything you say just misleading","2","0.3384329378604889"
"sidenote you know whats interesting the vlog where talking about the couchfabric swatches she demonstrates how having the current couch lshaped interrupts the flow the room which leads believe they rarely use the archway the right side the fireplace maybe they only need walk from the bedroom the kitchen and back shrug feel like closing that archway off could have helped least little with the floorplan and choice couch this point the fireplace fiasco feels like another step distract from the bookcases","0","0.23366779088974"
"seveda samo bojo takoj fdvjevci zabili nehumano kje sodstvo pri nas dovolilo podpisali smo kretenski samomorilni evropski dokument temeljnih lovekovih pravicah sodni sistem temelji iluziji rehabilitacije kriminalcov treba bit souten seveda nobenega zanimajo njihove rtve njihovih pravicah soutnosti njih duha sluha","0","0.4004829227924347"
"thank you much for contributing the rwyzecam subreddit this question regarding wyze product issue there monthly support megathread where wyze employee will help you out feel free use the future bot and this action was performed automatically please contact the moderators this subredditmessagecomposetorwyzecam you have any questions concerns","1","0.6319271326065063"
"embarked units units embarked within transport not count being the battlefield for any rules purposes this means that unless explicitly stated otherwise embarked units cannot anything shoot fight use abilities etc similarly you cannot select embarked unit target for any rules including stratagems","2","0.13853979110717773"
"healthcare has always been expensive and getting them pay when you need them has always been close impossible its still not perfect but obama put lot important measures place try get america better path when came healthcare blaming anyone but the insurance companies themselves absolute insanity","0","0.27556589245796204"
"draft fucking francis mauigoa carnell tate then not taken going into the round fernando mendoza then spend the rest the draft getting wrs some shit holy shit are ass offensively besides judkins and fannin isnt better fucking draft caleb downs and get either this horse shit","2","0.328454852104187"
"your account karma age post comment karma not meet our requirements try again the future will not tell you how long how much karma this designed thwart spammers sending message the moderators asking for exception the rules will get you banned bot and this action was performed automatically please contact the moderators this subredditmessagecomposetorthickthighs you have any questions concerns","1","0.7454952001571655"
"you sound really open minded and accepting lol are all older moms lol ones delusional just life for some people but great job thinking youre better than everyone else glad friends come from all walks life and understand everyone does what works best for their families","2","0.2622278332710266"
"its with the meat being fresh compared supermarket foods which are refigerated and days old most the meats they sell are the ones display which could left for hours and allow bacteria grow which why want find source which have vacumm sealed fresh meat just very high quality grass fed meat","0","0.1651436686515808"
"hey uclearlead thanks for submitting rconfidentlyincorrect take moment read our rules our discord server please report this post bad not relevant remember keep comment sections civil thanks bot and this action was performed automatically please contact the moderators this subredditmessagecomposetorconfidentlyincorrect you have any questions concerns","1","0.7459319829940796"
"there lot evidence that this happened obviously written documentation eyewitness testimony which the best youre gonna get far tangible proof that event happened thousands years ago then there archaeological evidence that lines with the bible and its locations the middle east with mentions factually historical figures like caesar the push disprove the evidence resurrection actually happening makes curious the underlying reason even christianitys harshest atheist critics even agree that jesus nazareth was real person and after died there were people that said they saw jesus resurrected","2","0.12476842850446701"
"welcome rjerkoffoncam stay safe dont share personal info use anonymousencrypted accounts avoid facetattoosidentifiers set boundaries and stop pressured helpful links browse create safe sexting bot set private bot for safer anonymous sexting stopsextortioncom guidance and resources youre threatened blackmailed related subs rgoonedmeetup rjerkoffchat rsnapchatbuds rjerkinginstruction rjerkoffoncam please follow all rules and local laws note these resources are shared users cant independently verify every link bot and this action was performed automatically please contact the moderators this subredditmessagecomposetorjerkoffoncam you have any questions concerns","1","0.7788308262825012"
"yeah but its complicated the army leadership were all members the islamic brotherhood however they are not ideologically committed now there broad coalition supporting the army from islamists communists liberals everyday people the overwhelming majority people support the army partially because how the rsf behave cities they control","2","0.22082987427711487"
"why would space aliens suddenly invalidate religions theyve been incorporating and changing their beliefs for centuries its not hard imagine them saying god also created these aliens and weve gotta tell them about jesus really wouldnt big deal people that already gobble lies and ask for seconds","2","0.23850835859775543"
"ive been there manual checks start feel like fulltime job after while one thing that sped things for was sorting emails domain first and running bulk checks grouped company instead random batches catchall filters usually repeat domain you can skip hundreds once you figure out how that companys setup behaves also built quick google sheets script that pings validation apis overnight everythings ready morning you ever need cleaner starting data ive seen companies like techsalerator clearbit offer lists that are already verified which helps skip most the grunt work","0","0.3940654397010803"
"ive just had hard time getting into some books second read tried reread lord the rings but after few hours just didnt sink its hook into like did the first time same thing with ursula leguins the dispossessed also didnt find maughams the razors edge interesting and enlightening the second read sometimes these rereads something just feels flat and have labor continue ways that didnt the first read","2","0.2757120132446289"
