"comment","topic","topic_prob"
"your suffering there profit business owner and can tell you the mindset becomes thats what you cost the company they get use paying you that amount and they dont want pay more you ask management pay you more they will never why you cost them year them its practically set stone wouldnt waste time with the discrimination route unless you have stellar legal case you know you deserve more quietly find new job that pays more and exit stage left you owe them nothing","2","0.22661347687244415"
"reminder the rules are there for all our benefit please report any violations keep the quality posters this general reminder and reason panic bot and this action was performed automatically please contact the moderators this subredditmessagecomposetorkarmansfw you have any questions concerns","1","0.7133472561836243"
"mean you know little about the details his situation seems pretty believable the mob got involved his incident which what caused the fbi stumble across him and what was doing sure gave them every piece information possibly could its not implausible think that the agents working his case are still there and they could still have contact","0","0.3010912537574768"
"formule kijken jointjes roken chips eten ben morgen ook vrij dus kan het laat maken verder wel leuk weekend vrijdag had mijn moeder uitgenodigd gaan lunchen gisteren niet veel gedaan eigenlijk alleen maar gamen battlefield vandaag had uitgeslapen tot toen wat huishoudelijke dingen gedaan","0","0.26097121834754944"
"personally take the cop small claims court you actually have all that evidence sue him for your wasted time taking off work commuting the court etc its only like file claim which youd just tack onto your lawsuit you dont need lawyer for small claims petty and for wasting time","0","0.3898391127586365"
"did you see this person put all the papers there did they leave them what the person that seat before then left all those papers not going judge someone for not doing anything wrong cleans the area before leaves harm foul not convinced its even his paper could the person behind him","0","0.3361088037490845"
"your post showing off homemade salsa sure include the recipe typedout comment fine otherwise the post will deleted hours your post about something else such question youre and may disregard this automatic message bot and this action was performed automatically please contact the moderators this subredditmessagecomposetorsalsasnobs you have any questions concerns","1","0.5616909265518188"
"its almost wide audi which why its classified suvcoupe parking similar issue like with suvs had issues with rear view camera and getting out the car but and live germany might have more bigger parking spaces then","0","0.2734719216823578"
"thank you for such informative reply ill definitely have take notes some the recipe stuff you wrote terms purely time how long would you estimate each portion takes every week grocery shopping prepping ingredients cooking washing dishes storing the food actually surprised that none your family makes what you eat because many friends and family usually eat home cooked stuff that family member makes idk this asian thing not actually used eat dads cooking which didnt like ended not cooking anymore much its really refreshing hear that doesnt always have communal activity","0","0.20129799842834473"
"lol yes work remotely salary but not bonus more like depending how well company does and was recently laid off few weeks ago currently unemployed and husband currently government shit down works for the feds not getting paid since october yeah thats fun income for either was also wfh for the past decade until they hauled everyone back office this year which makes zero sense for the type work does smh","0","0.261822909116745"
"love eyesight have liberty legacy outside australia eyesight has been fantastic has helped countless times today picking another subaru forester touring the legacy going sons first car all the safety features give assurance for him fact the weekend just did defensive driving course the legacy had disable the eyesight traction control and lan departure systems for the track and skid pan driving told even with those off the car was stable the instructor commented how well the subaru handles emergency braking high speed turns some small under steering have concerns with the eyesight cvt you just need servicing the subarus time","0","0.3291698098182678"
"when played with the first time had something like other friends playing and swear god when talked them about seemed like were playing different games still cant belive that this game was possible make hands down game the decade for now","2","0.4639379382133484"
"just finished the triumph guilded and everything and where the fuck was grinding all weekend get this god damn thing this the only thing wanted out this event know seems like such small thing but was not able get past years dealt with all their shit lately and have had high hopes but this finally pissed off lol","2","0.4130910336971283"
"hajde vidim ima nade tebe pokuam jednostavnije ovo navodi koliko kvadrata moe prije koliko sada biti vrijedi iskljuivo ako kupuje gotovinu tom sluaju nema spora potpuno pravu problem lei tome sagledava sve parametre kod uzimanja isplate kredita biti cijelog problema kreditima vicarcima iako danas stan nominalno kota vie znai vie kota realno kada ukljui sve parametre spominjem danas rizici daleko manji gledam perspektive mog kredita koji sam naveo ponavljam","0","0.4771552085876465"
"welcome rjerkoffoncam stay safe dont share personal info use anonymousencrypted accounts avoid facetattoosidentifiers set boundaries and stop pressured helpful links browse create safe sexting bot set private bot for safer anonymous sexting stopsextortioncom guidance and resources youre threatened blackmailed related subs rgoonedmeetup rjerkoffchat rsnapchatbuds rjerkinginstruction rjerkoffoncam please follow all rules and local laws note these resources are shared users cant independently verify every link bot and this action was performed automatically please contact the moderators this subredditmessagecomposetorjerkoffoncam you have any questions concerns","1","0.7788308262825012"
"today was real dig deep and find something kind performance yes needed setpiece but make mistake this team thats addicted winning and keeping clean sheet have shithouse our way league title then but need take pleasure these kinds wins crystal palace are pushovers and they were very stubborn defensively and just beat them while giving quarter our own theres lot take from that points the top clear city and clear liverpool will nicely need against burnley for sure brighton will tough too but have confidence that arteta will more fullstrength than people think","2","0.3312281370162964"
"merhaba ltfen sorunuzun subredditimizin konusuyla uyumlu olduundan emin olun sorunuzu sormadan nce subredditte veya arama motorlarnda arama yapmanz neririz ayrca sorunuzun anlalr bir dille dzgn formatlanm bir ekilde yazlmas nemlidir subreddit kurallarna uymayan gnderiler kaldrlr sorunuz subreddit konusuna tam olarak uymuyorsa raskturkey subredditini deneyebilirsiniz there please make sure that your question relevant the topic our subreddit recommend searching the subreddit using search engines before asking your question additionally important write your question clearly wellformatted manner posts that not comply with subreddit rules will removed your question doesnt fully match the subreddit topic you can try raskturkey bot and this action was performed automatically please contact the moderators this subredditmessagecomposetorturkey you have any questions concerns","1","0.6583459377288818"
"your post has been removed because you have low post karma andor you have low comment karma not the same post karma look google andor your account too new will not disclose the exact account age karma number needed post they are relatively easy achieve though you must meet all the above requirements postcomment comment karma post karma and age requirement please read for more information bot and this action was performed automatically please contact the moderators this subredditmessagecomposetorsneakermarket you have any questions concerns","1","0.6575490236282349"
"lots people who are out and have been out for years without being guys who are lot older than you are might better bet for you youre just coming out think youd want someones perspective whos come out over the last years are you basing your thing for older guys just their experience guide you are you genuinely attracted them","2","0.2015601098537445"
"hello please double check the pinned faq thread the homepage our sub and delete your post your question answered there please also check our questions megathread before making your post general questions should asked here youre asking your fake please delete your post and move the this fake megathread thank you please make sure youre following the rules for bst your post may deleted connect with discord funfacts for new fans faces are completely random standard series the cheek pattern eye taype and hair color are randomized however the face plates are removable and can swapped around bot and this action was performed automatically please contact the moderators this subredditmessagecomposetorbabythree you have any questions concerns","1","0.6813134551048279"
"could proper reading the bible starting genesis and finishing with revelation through and through but ultimately mans heart only going changed the holy spirit theres nothing can say thats going make you love the lord all can say what believe true the best abilities think you should refer the rhetorical question asked you though really think why youve created this worldview for yourself theres objective truth and you could just pick different worldview maybe the question you believe you can pick any kind worldview and yet you still believe gods eternal justice core part your beliefs why that why cant you just leave god out the equation perhaps your heart has already been pricked which case would offer the same advice genesis revelation start reading","2","0.2933352589607239"
"you dont mind spoilers the ancestor who having you clear out the dungeons isnt very good guy first discovered crazy evil magic stuff when noblewoman decided murder turned out mosquito monster formed from the portal underneath the estate successfully killed her nearly dying cause she was monster then decided hey gonna drain her blood and feed all the nobles party cause psycho who thinks thats funny does that mutating everyone the party who then form monster hierarchy trying mask that theyre blood sucking monsters behind noble facade and they corrupt the wildlife the whole garden and guest house the estate","2","0.36697039008140564"
"since you asked its probably corporate bureaucracy its finest because trailers and such are done marketing companies not the studio who producing the actual product the studio and marketing companies dont have direct contact relationship with each other marketing typically handled and contracted out the distribution company the distribution company usually the boss the production company power structure bit different than say disney sinclair stations the even they appear peers within the production committee who contracts the studio the lower level company involved","2","0.2222137749195099"
"tools like rufus can used bypass the hardware requirement checks for windows however this not advised installing windows unsupported computer will result the computer longer being entitled nor receiving all updates addition reduced performance and system stability one thing experiment and this for yourself however please not suggest others especially less tech savvy users attempt this bot and this action was performed automatically please contact the moderators this subredditmessagecomposetorwindowshelp you have any questions concerns","0","0.14841116964817047"
"not saying that there arent some great private attorneys saying that youre better off with the you qualify because pds are more uniformly pretty good whereas private attorneys vary wildly quality and youre not really familiar with criminal defense its going nearly impossible for you tell based their marketing whether the person youre hiring one the good ones crappy one with good marketing hence almost always better off you might luck into good lawyer but really will matter luck and even then they wont have the institutional resources office has","0","0.3515473008155823"
"fyi depending where you live talk local estate lawyer confirm you can charge for executor services that means the estate pays you for your time that payout typically comes before the beneficiary payouts before you make any choices would worth find out what your responsibilities that would with would what your dads estates responsibility could towards you this situation executor services would the higher end whats allowable lol","0","0.2381611168384552"
"please note this post has been locked all posts rhoustonrr are responses should pmed spiritualinsect directly this because personal ads are not discussion topics and houstonrr not discussion forum heres link for mobile users spiritualinsect posters who wish allow public comments their post may adding unlock the body their submissions please remember that all comments will still subject subreddit rules you are interested this post always read through posters profile look for red flags before replying post always vet the user before sharing any personal information with them spiritualinsects profile this post breaks the rules there issue with this post and breaks the rules please message the mods and report the post you believe the user not who they say they are please message the mods contact the moderators here some common red flags watch out for asking for money gift cards this will always scam mismatched ages posts comments the users location changes often the gender the user changes between posts the wording post identical another users post user asks for email provides one user requests that you bring them food pay them exchange for something posts includes username for party application this against subreddit rules always kind each other use common sense and have fun pmed spiritualinsect directly spiritualinsect spiritualinsects profile contact the moderators here bot and this action was performed automatically please contact the moderators this subredditmessagecomposetorhoustonrr you have any questions concerns","1","0.7313398122787476"
"understand really frustrating dont agree with you that your fault you hired company that represented themselves professional carpet cleaning company you are not professional carpet cleaner you hired someone with the necessary expertise that was the right thing the fact that they destroyed your rug was their fault not yours professional company they should responsible for correcting the damage paying for replacement the reality that matter how much research these companies rare that get that over the moon experience that some reviews describe and sometimes its the opposite sure you did your research the simple fact that they represented themselves professional company and they did terrible job destroying your company none and mean none that your fault you havent already would press them make right","0","0.3151419758796692"
"they look very similar but they are actually very different gameplay mechanics think totk made much better for everything increased the durability alongside with the amount enemies and gave better bosses they all except one felt like different phases the same bossfight the first game dont know which one pick chatgpt says totk better but the community keeps saying that botw better why people hate totk much","2","0.464729905128479"
"your argument flawed dont cant bring another superstar because dont have the cap for unless the owner decided pay the luxury what could done others have mentioned use some end rotation mid rotation guys and picks consolidate position bring role player who has playoff experience thats all assuming wanted compete this season need all that want develop inhouse but that hasnt been working out weve been leapfrogged okc","2","0.4226454198360443"
"dont know because was the first that used when got into linux suse around during that time you had the work make work was able much what could windows then seeing how customizable was kept coming back also anytime tried any other would try make look like kde why not just use outright","0","0.24662479758262634"
"thanks for your listing make everyones experience easier please take note the following rules mark post sold automatically mark your post sold just comment any these sold sold sold the comments section this will automatically update the post flair sold bot and this action was performed automatically please contact the moderators this subredditmessagecomposetordelhimarketplace you have any questions concerns","1","0.6354098320007324"
"its tough situation because ticketmaster cant cancel all resale tickets that were bought violation their policy except ones that were resold fans scalpers broke the rules buy those tickets and ticketmaster being forced the ftcs lawsuit enforce its rules shouldve never happened the first place and ticketmaster terrible company for allowing","2","0.2844657897949219"
"welcome rjerkinginstruction stay safe dont share personal info use anonymousencrypted accounts avoid facetattoosidentifiers set boundaries and stop pressured helpful links browse create safe sexting bot set private bot for safer anonymous sexting stopsextortioncom guidance and resources youre threatened blackmailed related subs rgoonedmeetup rjerkoffchat rsnapchatbuds rjerkinginstruction rjerkoffoncam please follow all rules and local laws note these resources are shared users cant independently verify every link bot and this action was performed automatically please contact the moderators this subredditmessagecomposetorjerkinginstruction you have any questions concerns","1","0.8152892589569092"
"rtopsandbottomscommentsogostehowwasyourfirsttimebottomingandwhy hello importanceno your submission rtopsandbottoms has recieved multiple reports against and has been automatically removed you believe your post was removed mistake please send the mods link your post and let know your issue thanks bot and this action was performed automatically please contact the moderators this subredditmessagecomposetortopsandbottoms you have any questions concerns","1","0.6628129482269287"
"oom only gives hit rerolls combat patrol not plus wound also not available strategic reserves units dont actually have point values combat patrol there functional way assign strat reserves units towards the limit some units still have deep strike though only those units are able start the game reserves and while all core stratagems are available some are useless for example have yet see combat patrol datasheet that has not had the grenades keyword stripped from either get the official warhammer app and check the faction page for the combat patrol here download info including the core rules fyi think the core combat patrol document might even towards the back the space marine codex","2","0.1760444939136505"
"she good and upgrade most the idk lol specific buff but you have build the team around her and its incredibly annoying basically like columbina buff flins teams but only you have ineffa otherwise sidegrade but the truth that people expected and wanted mega powercrept tribbie one the strongest and most universal character and she isnt","2","0.3805614411830902"
"yeah its not even partisan statement say california run like third world country with resource curse just tech instead diamonds gold mines they took one the most beautiful landscapes earth with the most productive industry human history and managed somehow make unliveable unless youre rich theyve only approved handful rebuilding permits after the fires the people running the state are total clowns and would viewed that way even the most left wing policy people years ago","2","0.20071159303188324"
"when said wouldnt want our future kid bring home person color was wraps its like grieving the first version him that knew before this would have been perfect for wasnt for this cannot believe can even think like that","2","0.38897043466567993"
"ive read your points and okay with leaving difference opinion your goal was just say there are better options thats fine but feraligatr favorite pokemon never needed beat out any other pokemon for enjoy and utilize again this game was not made with vgc mind could rebut few your points but dont really think its necessary because never said feraligatr was literally the best water pokemon the game its just favorite and think any fans should celebrate the fact that got any shine all comparing apples oranges doesnt change the taste and enjoyability either","2","0.41244882345199585"
"are you talking about gyoubu cant see the spesific problem here basically the more you deflect the easier you will get the deathblow and when you dont hit deflect them consistently they regain the posture lost even you deflect lot you might have long fight you cant keep the pressure dont hesitate","2","0.2907199561595917"
"thanks for taking the time share your thoughts case would like use copilot studio the plan later extent capabilities via different topics the same concept working very well agent build with the builder copilot studio light but seems without connectors the full studio has less flexibility got also suggestion ask user upload specific sharepoint location and the specific link part the knowledge package would not need connector export text from pdf but far did not manage make work","0","0.288894385099411"
"iedomjies visu savu dzvi velc tos dmus plaus dom vai tev dmi trauctu kds tev blakm smtu smtji pieradui tiem tie neizraisa diskomfortu tpc tie nesaprot par jezga aizrdjums uztveras diskrimincija cilvkiem dadas perspektvas smana jau aizliegta pieturs pie ieejm tam ldzgi pat balkoniem neesmu dros vai var fakta jau vari policiju saukt vienkri neviens nedars","0","0.3243521451950073"
"for kintetsu trains the limited express seat fee extra charge top your base fare from osaka namba shiroko the seat fee around yen depending the train and time day far remember you need this ticket because all limited express seats are reserved you can buy the limited express ticket any kintetsu station from machine ticket counter just tell the staff select your departure and destination date and time you can also book online through kintetsus english website and pick the ticket later youre using the kintetsu rail pass covers the base fare but you still have pay the limited express seat fee separately once you arrive shiroko station you can take short local bus taxi suzuka circuit since its for the weekend trains will crowded its smart book the limited express seat advance guarantee spot and smooth trip","0","0.1760869026184082"
"assume you are from norway then the amount reported crime per people used crimes the immigrant population the time was only million crimes per people were reported despite the immigrant population having doubled since then reaching million immigrantion was really importing crime wouldnt the rate crime have doubled instead fallen crime socioeconomic factor poor people commit more crimes and immigrants are more likely poor they come countries without really any networks they then are stuck doing lowwage jobs this makes people turn crime","0","0.21646574139595032"
"uirradiatedhellreaper this submission has been automatically removed because very short its quite likely that the post breaks one our subreddit rules your thread may need more detail its topic may not allowed our rules such questions with specific answer questions that generate short answers your thread was asking for suggestions about what games get then you should look asking either rgamingsuggestions rshouldibuythisgame raskgames you are looking for the name game then you should try rtipofmyjoystick please send message you think that the bots removal inaccurate bot and this action was performed automatically please contact the moderators this subredditmessagecomposetorgames you have any questions concerns","1","0.5631656646728516"
"but were talking about theoretical boxing match with real physics place one person just happens invulnerable you get ragdolled around without being competitive the ref will call off the fight doesnt matter youre physically capable continuing the theoretical match here boxing match with boxing rules whats the point adding lbs the prompt why not lbs clearly its because affects the outcome also its literally the prompt can still knocked and thrown around but will never cut bruise never injured never feel pain and never become dizzy fatigued out breath","2","0.33472806215286255"
"honestly his record think hes going have hard time record homelessness record high cost living record high cost housing highest state taxes the country billions spent solving homelessness billions spent high speed rail billions surplus with infrastructure spending surplus deficits cleared out homeless from for afterwards ignores the problem hes typical politician with real results speak for","2","0.2504268288612366"
"like his idealism and the fact that used his trauma fuel change the status quo know that was kind idiot with some his plans but the end the day was pretty close achieving his goals and played most stars fools rose from being orphan sex toy politician being well respected warrior and politician","2","0.3399851322174072"
