"comment","topic","topic_prob"
"welcome rfastsexting stay safe follow all rules and remember your safety and privacy come first always think twice join fastsexting discord server our affiliates hedoncustoms the best platform for buying and selling custom content fast bot and this action was performed automatically please contact the moderators this subredditmessagecomposetorfastsexting you have any questions concerns","1","0.7342534065246582"
"hello uverwatchlover thank you for posting rhentaiandroleplayy make sure your submission follows the rules you can find them the about section the sidebar our subreddit reminder any submission which breaks the terms service doesnt have plot stated the title requests feedingtrading imagesmessagesnudes features unapproved advertisement will result ban highly encourage users report submissions breaking the rules have active modteam making sure you have satisfying and safe experience you have any feedback that you need tell please send direct modmail clicking messaging the moderators the sidebar mobile clicking the three dots the homepage bot and this action was performed automatically please contact the moderators this subredditmessagecomposetorhentaiandroleplayy you have any questions concerns","1","0.7732633352279663"
"the way hes going about this messed this clearly not conversation seems like hes just diminishing you and not really listening its that you fucked shouldnt treating you like this also are you both young only ask because sounds similar way teenage couple might talk and might shed some light how hes reacting","2","0.1434755027294159"
"welcome rjerkoffoncam stay safe dont share personal info use anonymousencrypted accounts avoid facetattoosidentifiers set boundaries and stop pressured helpful links browse create safe sexting bot set private bot for safer anonymous sexting stopsextortioncom guidance and resources youre threatened blackmailed related subs rgoonedmeetup rjerkoffchat rsnapchatbuds rjerkinginstruction rjerkoffoncam please follow all rules and local laws note these resources are shared users cant independently verify every link bot and this action was performed automatically please contact the moderators this subredditmessagecomposetorjerkoffoncam you have any questions concerns","1","0.7788308262825012"
"welcome rjerkoffchat stay safe dont share personal info use anonymousencrypted accounts avoid facetattoosidentifiers set boundaries and stop pressured helpful links browse create safe sexting bot set private bot for safer anonymous sexting stopsextortioncom guidance and resources youre threatened blackmailed related subs rgoonedmeetup rsnapchatbuds rjerkinginstruction rjerkoffoncam please follow all rules and local laws note these resources are shared users cant independently verify every link bot and this action was performed automatically please contact the moderators this subredditmessagecomposetorjerkoffchat you have any questions concerns","1","0.8043125867843628"
"sua postagemcomentrio est desacordo com regra comunidade motivo contedo nocivo comunidade spam propaganda desinformao golpes saiba mais reddit combate spam intensamente seus filtros suspendem indefinidamente contas suspeitas spam resultando num shadowban elas seguem ativas mas suas interaes ficam invisveis aos outros para normalizar sua conta por favor leia guia comunidade sobre shadow ban entre contato com moderao caso tenha dvidas permitido promover produtos servios nesta comunidade postagens com golpes desinformao sero removidas","1","0.4224032759666443"
"see lot people public servers putting brontos when hatching eggs one time checked guys garden with brontos but when checked their stats only needed the brontos told him wanted trade his brontos for kois andostriches for more use his pet slots but guess took offense started trash talking for reason and left lol","2","0.3037368655204773"
"you mean the latest masterpiece fantasy storytelling from lucasfilms brian moriarty why its extraordinary adventure with interface magic stunning highresolution landscapes sophisticated score and musical effects not mention the detailed animation and special effects elegant point click control characters objects and magic spells beat the rush out and buy loom today","2","0.31237709522247314"
"back putin couldnt legally run for third term had medvedev take the presidency while slid into the prime minister spot later pushed change make presidential terms six years instead four then reset his own term limits clearing the way stay power until his win with the vote most observers say that number statistically impossible sounds like what trump trying russifying the","2","0.12616893649101257"
"impressiveheron please check the sidebar for the rules this sub this post violates the rules please check and report this post recommended subs roffmychestunfiltered rwhatmendontsay raskmenrelationships automoderator has recorded your post prevent repeat posts your post has not been removed impressiveheron originally posted dating this guy who said point enjoyed being nonchalantmysterious but didnt really say why find annoying try ask questions about his activitiesdays and hes pretty short and difficult talk seems very aware though which gives the impression its act keep from getting serious its literally only been few weeks talking and like two dates cant tell for sure yet but also just threw the dont like texting much which also fine thats really the case also hate texting but just trying get sex were unable have sex the first two dates not sure hes expecting the third but with this behavior dont even want could possible hes nervous and inexperienced with dating and thinks this will win over likely player that using the act show only wants sex bot and this action was performed automatically please contact the moderators this subredditmessagecomposetoraskmenadvice you have any questions concerns","1","0.5846166610717773"
"you can only wear the old uniform you didnt have all the pieces for the new one this point would have approved supervisor there wasnt time where you could wear mix either all old all new the only time ive seen people with the old uniform the last couple months was for maternity","2","0.22563189268112183"
"well you said yourself that might not make profit and demanding that band something like that that takes much time and money and coordination because they theoretically have the money pay for would just rude and entitled brendon has family and stopped touring because his priorities are with his wife and child maybe wants put his money towards his kid and not youtube video","2","0.31765180826187134"
"both are good people heart can see that the show but who better cant say that because ashnoor had very safe and happy childhood and treated princess her parents she never learned raise voice may cursing because she doesnt needed that her life her parents were there protecting her when comes farhana she fought her way reach this stage when people fought their way through suppression they will pickup some bad things along the line like raising voice and cursing armour weapons cant judge that should judge her intentions she genuinely good hearted person","2","0.4090847969055176"
"cousin was mafs wont say who was but all told him was crazy had girlfriend months when got the call was going told wanted lift his profile because had business needed get promoted was trashed mafs but actually did lift his business profile thought his life would over but had positive impact his business and when say was trashed was trashed maybe the old adage any publicity good publicity true","2","0.3607582449913025"
"your comment has been removed recommerce because you not meet the user requirements post comment you not have enough comment karma account age days both conditions must met please read the sub rules the top our main page for full posting and commenting guidelines bot and this action was performed automatically please contact the moderators this subredditmessagecomposetorecommerce you have any questions concerns","1","0.6406614184379578"
"this dude fucking freak nature dont even like baseball but watching this dude just blows away its not even fair makes the best pitchers the world look like fucking amateurs someone told pitcher would dominant hitter decade ago wouldnt believe them","2","0.3600073456764221"
"guess terrible twos episode autistic year old specifically obsessed with the first half the first season but ive seen way more than that the past but for some reason really freaks him out sometimes too think because its when sneezes out and becomes that really freaks out","2","0.2331678420305252"
"greg and ensure your submission follows the rules and flaired appropriately your submission violates the rules isnt correctly flaired might removed the discretion mod please make sure that you bring post inquiry modmail you link the post question are unable help those who not link the post this comment automatic reminder and you are not trouble posted every submission the subreddit bot and this action was performed automatically please contact the moderators this subredditmessagecomposetordannygonzalez you have any questions concerns","1","0.7029533386230469"
"this video seems stage like what went through his head hey that looks like lost dog let pull phone out and start recording before approach him saw lost dog the first thing head sprint him and not let pull phone out first and start recording just case","0","0.24795548617839813"
"cant help but wonder doing anything wrong with that case have that case and the airflow situation from the front intake isnt any good the hdds the front require higher static pressure fans push air through the hdd caddys says has mount for the optical drive but proper place screw for support the case has been with for years and now the front intake mesh has started rust and crumble have they changed the quality design any way for suggested over the other cases looked for the thread but cannot find which one exactly youre talking about the one where was about someone asking for case suggestion","0","0.2347443550825119"
"first the illegal invasion ukraine the highest russian leadership putin denies ukrainian nationhood deliberate targeting civilians proven double tap attacks first responders and drone footage using rape weapon against their own troops too have fun when you get sent kidnapping ukrainian children and russifying them camps the order which comes from russian leadership icc wanted criminals putin and maria lvovabelova russia displays clear intent genocide against ukrainian people","0","0.11870452761650085"
"dont think but rather know because paid attention civics class and because ive paid attention throughout life our municipal governments that the chief executive government has great deal authority over policy and can play major role directing legislation for that reason want major reform have elect executive and legislature who will work tandem implement the relevant reforms gee wonder whats about happen the seattle and bellevue ballots this coming week","2","0.22541680932044983"
"dont dread too hard this more like chronic illness now that you will have through treatment but life will return normal albeit little adjusted was diagnosis with kids and had surgery chemo last year now double hormone blocker therapy and had another surgery corrective not strictly necessary ride horse strength training worked full time through everything almost normal except hair refuses grow haha gained weight last year lost all back normal now much felt like the ground was slipping from under when was diagnosed have now emerged the other side wiser anything you can this dont let consume more your life than has being very fit helps you lot because you will recover from everything more smoothly","2","0.26959916949272156"
"all the season pois and mythics was such fun season also had the best story the season least enjoyed the most many fun weapons this chapter too especially this last season wrecker collateral damage minigun air strikes the mortal kombat mythics all the crazy blasters the star wars miniseason","2","0.38509252667427063"
"please reply the correct answer with solved include the additionally use our spotlight feature tappingclicking the three dots and selecting spotlight pin this comment order highlight for other members thanks for using our friendly automod bot and this action was performed automatically please contact the moderators this subredditmessagecomposetorwhatisit you have any questions concerns","1","0.42166346311569214"
"not feel guilty for leaving him you need get divorce making generated nude another girl not just any girl but one best friends with who also had crush one point while being married crazy generated that image for reason and its because hes sexually attracted her your husband should only sexually attracted you leave him and dont look back","0","0.12218363583087921"
"freelancer yes and when comes money expat always keep track finances and taxes helps during tax fillings reduces dependency accountant well manually best some way with platforms apps specific country free ones are available such mint gnucash irsgo case different currencies use cross country platforms ones such settel","0","0.33099910616874695"
"shes the voice head when the store and cant find shit but its like fuck them signs that bitch right there knows where every damn thing and can get the fuck out this god awful hell hole and away from all these fucking people then ask and theyre like sir just vendor dont actually work here kick the ladder out from under them and throw their whole crate fucking wonderbread their stupid fucking face and steal their fuckin twinkies then snap out and apologize the grandma whos cart blocking because thought the corner the fucking building was well out everyones way for have inner tantrum wrong can someone explain please how always somefuckingbodys way the store wheres the safe spot for husbands and fathers stand while their wife and kids raid the isle and bring back the loot","2","0.3412782549858093"
"your first thought should get proper brick and mortar bank account you can talk people and not bots real banks dont restrict access accounts without solid legal evidence fraud money laundering criminal activity please take this wake call move your funds real bank revolut fine for travel money and backup onlineonly account but for anything else can unmitigated disaster please learn from this experience and warn any friends that have all their money onlineonly banks","0","0.3732525110244751"
"you appear lack flair here guide for new reddit guide for old reddit and guide for mobile reddit you cannot locate your age and gender please message asking for the correct gender flair please also specify you want your age with well thanks bot and this action was performed automatically please contact the moderators this subredditmessagecomposetoraskteengirls you have any questions concerns","1","0.5624405145645142"
"could argue having amakusa replace one the nus but basically this but have theory you suck lack meta supportraid just gen stack one the gens has good range and data link its plus point being crummy raid and getting chat spammed being support and being bullied because your team doesnt care about you you cant assert yourself","2","0.49439120292663574"
"mucho puede decir desde punto vista externo general por ejemplo forma que ciertos grupos poblaciones judas hiper ricas haban generado prstamos alemania que asociaban general con polticos horrendos gente tacaa desagradable hermtica muy mezquina con gente juda como hoy sucede pero general cosa visin muy personal eso nica forma conocerlo leer lucha adolph hitler","0","0.13143354654312134"
"well apparently you didnt read the wikipedia article very closely because you had you would see that medical euthanasia was responsible for all deaths canada which the last year have public record for fact you the source for the wikipedia article they indeed disclosed the numbers for how many people will reject heed how many requests were withdrawn fifth annual report medical assistance dying canada canadaca you get into there were requests for using maid people used the maid program were rejected for not meeting the legal standard were withdrawn the participant and died before the procedure could performed this puts the acceptance rate closer rather than again this public record primarily because being used ongoing litigation conclusion all deaths canada for the year quite bit more than few people and the rejection rate much lower than you seem think and talking people out even lower not quite check mate","2","0.25593388080596924"
"listen here all you old timers lol now that have your attention yourself favor and listen drain there band from santa cruz but they seriously fucking rock they even wear panterametallica shirts they know what food music songs suggest are good good things watch you burn living proof feel the pressure california cursed those are all fuckin sick ass songs whoever reading this obviously have some time hands urself favor and listen couple songs theyll surprise the shit out you used think still mostly that good rock music and was just thing the past that one from this era even comes close rock roll from back the day but telling you theyre the bestclosest youll get the badass shit all know love now ill answer your question lol metallica alice chainslayne stanley only iron maiden megadeath pink floyd led zeppelin credence clearwater one two tesla songs van halen motley crue sex pistols misfits social distortion pennywise and fucking love old school gangster rap and most but definitely not all rap from today last but not least uicideboys till fucking die","2","0.3517981767654419"
"had the exact same problem with daith piercing would sit more forwards then ear piercer told this would happen got pierced very shallow piercer also told get fabric bandaid and cut little strips and stick down every night did for week and worked fine and havent had anymore problems just taped the top the earring kinda like where youd get rook flat","0","0.19038036465644836"
"dont hate for this but the one thing dont see way safely use and automation work believe microsoft working this work copilot for windows etc fact just forget give desktop automation tool that lets orchestrate apps and perform tasks later make optional connect agentic for the desktop has nice ring but maybe oxymoronic yeah there are areas innovation not happening linux","0","0.3389805853366852"
"your post was removed because there simply not enough information provided for anyone provide you with useful answer before you post again please check that youve provided with concise problem description the title and not just please help the right experts will open and read your post perhaps have look our asking for help quick guide which provides guidance what include and how this makes easier for people who want help you able your post text make sure youve given all the information you have access more better include your entire hardware layout every component youre using the circuit layout not photo video wires your computer code make sure you format properly screenshots code and describe what you thought would happen and what actually happened include any error messages well you are encouraged include photo your circuit andor video your project provides additional information but these are strictly addition not place proper circuit diagram and code formatted code block you need more help please check the sidebar for more information","1","0.38431936502456665"
"indifferent wouldnt mind having single thats verified every job now have create new account with upload passport and driving licence last payslips can find them wait for them find something ive not uploaded done its bit faff however cant digitally exclude those who dont have the means use digital those worried about your data being sold your data already tracked and sold private companies anyway","0","0.3740779757499695"
"yes but those meek tall guys are still visibly dangerous and thus imposing ill add have friend that lbs and the nicest most gentle person youd meet but watched someone egregiously cross line with him and fully underestimate his size until that day had never seen someone lift person off the ground their jacket with one arm and punch them the face with the other","2","0.219558447599411"
"you have want friendly relationship with your roommate then yeah you might overreacting you can let the know sweetly that you were hurt and give them chance make things right and kindness doesnt work and behavior persists there are more issues than just the houseguest","2","0.16924235224723816"
"the reason shouldnt changed because theres reason for the change the current rules are easy understand and simple they dont require lot odd outliers just justify likely minor change why not make phrexian mana not count symbols cards text its odd that hybrid costed card can monocolor deck but commander with that same hybrid cost would somehow not monocolor also typically the onus the people proposing change justify why its necessary not the other way around just strikes odd why with many actual issues with the format theyre instead focusing trying change one the fundamental rules that has basically existed forever the format","2","0.39786234498023987"
"pentax prime lens are severely underrated imoa lot them look amazing plus have found using prime lens beginner helped ton force you closer and more intimate with the subject forgot who said this your photographs arent good enough you arent close enough dont just zoom out there with whatever you are photographing","0","0.27537351846694946"
"flex player dont preselect anyone because people will absolutely ban the character preselect after try banning jeff which would mean theyre actually wasting ban since have lord characters ive been regularly using for competitive and many others can play the same level well have least one jeff the majority matches though and have many reasons why not want deal with players selecting him","2","0.3643094599246979"
"well obviously water cant rush into compartments above water can burn but youre not going changing the displacement the carrier blowing something above the waterline feel like modified zebra set underway properly and you have decent crew set full zebra something was happening would pretty hard actually sink carrier","0","0.16734038293361664"
"click here message the comments all rgbrr posts are now locked due spam selling and comments not lock the comments posts with the meta tag you want make post discussing the state the subreddit please post with the meta tag example meta can please lock the comments bot and this action was performed automatically please contact the moderators this subredditmessagecomposetorgbrr you have any questions concerns","1","0.6031752824783325"
"come here motivator school circle real quick and look the eye and give honest answer you can give from marine future marine tell why you think its good idea participate month long training cycle one the most difficult physically straining and mentally draining professional military basic training courses the military you dont meet the bare minimum basic physical requirements","2","0.28932321071624756"
"what frustrates that hugh jackman broadway star shocked couldve sounded good hadnt been pushed hit notes way outside his range and kept working while dehydrated for days get that they wanted bigname actor with film experience but since theyd already picked jackman they really shouldnt have put him the wrong vocal spot like that","2","0.37909209728240967"
"post was removed for being way too long please put the question the title and use the body give context necessary keep succint dont post your life story dont post wall text dont post novel current character limit characters feel free repost within the guidlines given above bot and this action was performed automatically please contact the moderators this subredditmessagecomposetoraskredditafterdark you have any questions concerns","1","0.7259440422058105"
"didnt make the term module fragment just got the concepts mixed module fragments actually refer vertical sections the module within the same file the global fragment where you can includes and other preprocessor things you were right identify that dont want confuse others with word salad","2","0.12373790144920349"
