"comment","topic","topic_prob"
"hey there are you here advertise your onlyfans yes this message meant for you there popular and rising shout for shout program going that meant for onlyfans models work together and gain fans the fastest possible way just working together the program completely free strings attached and you will get into properly maintained group with other models work together and gain massive amounts fans shout for shout programs are proven the most effective method advertising amongst the onlyfans models and everyone praising for their usefulness join today and get into the action read more the channel bot and this action was performed automatically please contact the moderators this subredditmessagecomposetorbackview you have any questions concerns","1","0.5011231899261475"
"race manipulation changing the outcome for more than just yourself you choose ride around the back the pack the whole race only affects your race nobody else please explain how that manipulates the race what way did change anyone elses race day now the ran the back and then slowed down blocked certain lead pack cars that would manipulation","2","0.33591803908348083"
"why are you asking what news have you been following for the past years youre asking for too much you explain your understanding all the laws that were broken and people who went prison maybe ill get bored and help you fill details not here educate fool with knowledge","0","0.30736249685287476"
"just heads this post has been locked all posts rdirtyrr are this because personal ads are not discussion topics and rdirtyrr not discussion forum read that again this busy subreddit you modmail ask why your post was locked will have block you for week responses should pmed directly heres convenient link not give anyone reddit your phone number instagram whatsapp any contact info telegram that could used find your phone number some losers are using for facebooklookups doxblackmail redditors not offer request share picsvideos anyone other than yourself breaks our rules and reddit also likely suspend you for they message you uokeconomist not mod they are banned here for attempting impersonate mod this poster breaking our rules please use the report button and send proofscreenshots the moderators bot and this action was performed automatically please contact the moderators this subredditmessagecomposetordirtyrr you have any questions concerns","1","0.7556431293487549"
"this user has posted more than once without verification this can fake catfish account careful also uefficientad verify yourself remove this message you can also visit fuckonlivecom watch live and horny indian girls for free bot and this action was performed automatically please contact the moderators this subredditmessagecomposetorindiansgetlaid you have any questions concerns","1","0.723450779914856"
"how meat easier access instead buying and eating different veggies you can get the same nutritional benefit from piece steak especially cost living crisis switched from steak mix steakporkground beefchicken its not hard unless you are literally homeless its also harder store not true you can get quarter cow and its good freezer for year anything veggies rot faster than meat since you cant really freeze them easily nutrition isnt better the body needs carbs and fiber the body doesnt need carbs its just that converts carbs into energy faster than proteinfats fiber there allow you shit easier but otherwise steak and eggs are incredibly nutrient dense that you dont need much else besides the supplemental veggies for fiber and some fruit for taste you keep ascertaining that less meat and veganism the same and cult can you please clarify why that you know what cult you dont see meat eaters advocating for eating less veggies they just eat meat lift weights and get jacked all see vegan zealots propagating the false gospel veganism and how holy they are because they love chew grass that homie cult","2","0.2203083336353302"
"struggling with the exact same thing currently sober start hitting head and shaking try stop the thoughts but obviously that doesnt help too lost weight cant sleep quite unwell people always say stop drinking but they dont understand what its actually like having constant bully head","2","0.15717239677906036"
"the lyrics are not the issue much how they are delivered and also the beats have not aged well other albums from the mids that being said respect hov lot for consistently dropping albums for yrs straight with many them being outright classics and others hood classics","2","0.44412070512771606"
"please respectful and follow the community rules this place for people who love rep sneakers share discuss and enjoy drama disrespectanyone causing problems will sanctioned and may banned bot and this action was performed automatically please contact the moderators this subredditmessagecomposetorrepsneakersdogs you have any questions concerns","1","0.6793501377105713"
"sounds like opportunities might pretty limited there which sucks thats the case would not let anyone win but they hit more and more gas will not here work that hard let them get tired and worn out need for what you well but dont kill yourself win just work way that you feel good about the work youre doing apart from results let them carry the burden results its fickle and always wants more thats their lesson learn its something you really want just count the cost what get and what does cost willing pay usually the answer but that allows you really all out when its truly yes","2","0.31886664032936096"
"your post has been removed because you not meet the minimum karmaage requirements for posting these measures have been put place prevent scammingabuse please read the entire message carefully before using modmail order have your posts not removed you must the following wait until your account least days old acquire least karma your reddit account you need meet both the above requirements able post you not know what karma not know how get more karma you can refer this link you cant get karma posting here because your posts will deleted youll have different subreddit and post there bot and this action was performed automatically please contact the moderators this subredditmessagecomposetorpokemongotrade you have any questions concerns","1","0.7459306120872498"
"thats exactly point people who have all their diplomas june people who have already taken them will have grades lower than people who didnt even have take them solution postpone the january diplomas about instructional days allow for equal instruction between the two sectors reduce the weightings weighting unfair for you yes but and insane grade inflation also unfair too","2","0.3115301728248596"
"personally wouldnt worry too much about shit getting expensive dad years whos been your position ive found the following true with kid that small will miracle you get maps weeks lol two weeks there are normally some massive shifts the meta people figure out whats completely fucking broken this league and word gets around you cant predict what that and involves build enabling items for your build youre fucked conversely its not your build even your build pretty meta youll find tons people switching away from your build and selling their stuff weeks into the league prices for anything except the rarest uniques generally come down over time actually gets easier farm more currency later because things like harvest have window where theyre worth lot that hits couple weeks look what actually valuable you make endgame farming and focus that always make shitload money getting into red maps just from adding harvest everywhere the old niko node that got nerfed was great for this too resonator prices went people started crafting earnest","2","0.46684396266937256"
"please read the recent reminder our rules before commenting posting thank you ukennyben has the following flair trades gsball users must finalize discussion the comments before moving pms ukennyben not deal with anyone who cannot comment your post click here learn how leave feedback and increase your flair count all our rules and guidelines can found here user trade counts can found the user flair next their name see detailed list references click send this message you believe you have been scammed please fill out this form bot and this action was performed automatically please contact the moderators this subredditmessagecomposetorpkmntcgtrades you have any questions concerns","1","0.6694151163101196"
"your account not old enough does not have enough karma post here try again the future will not make exception asking for the limits number will result your account being banned from this subreddit please see here how reddit karma works bot and this action was performed automatically please contact the moderators this subredditmessagecomposetorpornid you have any questions concerns","1","0.5668948888778687"
"probably centrism play dont associate violence gore with taboo the same way the suggestion that someone might have nipple maybe its because associate work with like factory and blue collar jobs where you might get maimed but have comparatively lower likelihood seeing someones junk","2","0.34965479373931885"
"one thing funny you wanted her support you after she giving birth child shouldnt exact opposite also felt that all you want fun like back quickly after childbirth mean six months too soon considering hormonal havoc that pregnancy does someone and also felt only she parent and you are not that involved this the case someone said the comments that there lot even felt","2","0.1703420877456665"
"for the democrat the essence fascism that openly uses illegal violence and abolishes democratic rights and freedoms and precisely against this that they whine pitifully for there neither reason whine nor satisfied with such characterization have always denied that the class struggle could refereed allegedly superior authority like football match have always maintained that the working class cannot conquer political power democratically that even the most democratic constitution serves protect the capitalist form production that democracy masks the dictatorship the bourgeoisie even when not like has done often drowning the labor movement blood rejecting violence invoking the legality democracy means renouncing the revolution from the outset contrast rejoice when the bourgeoisie throws off the velvet glove democracy openly shows the workers its iron fist and thus proves them that there justice that stands above the classes that the law expresses nothing other than the balance power the classes international communist party","2","0.19186902046203613"
"would say having presented the work conference gives lot credibility manuscript preparation claim you were too early would not have been presented yet consider also listing the conference abstract even just abstract long publicly available online support your claim and role the article manuscripts","0","0.316338449716568"
"hey there interested take this ive worked comic artist for indie writers for over year now and absolutely love working this side the industry long time manga buff here btw spent most time high school collecting and reading manga ive always had deep appreciation for manga and always try learn and replicate the techniques you should know however that until now ive mostly worked with colour since mangas are traditionally black and white dont mind going that route either have look portfolio you wanna take closer look panelling character designs cover art and full page spreads well action sequences lemme know you wanna chat until then heres portfolio goodluck","0","0.322302907705307"
"please read make sure your post follows all rules and does not break any the permanent ban rules make sure your post using the correct post flair else will removed until you edit and fix all social media accounts such session ids telegram ids teleguard ids and discord usernames must placed the comments section body text only not the title bot and this action was performed automatically please contact the moderators this subredditmessagecomposetorhentailimitless you have any questions concerns","1","0.7310076951980591"
"think she actually knows that shes not perfect but has created this social image shield even tho were clearly seeing through and youre pointing very interesting thing well when does mary has really been held accoutable for saying horrible things the cast since shes not responding super herratic way like lisa the cast seems let because theres nothing milk looks bit hypocretical","2","0.3501225411891937"
"hey there ustarvemeandmakemecry whoops sorry looks like one going see your post because are currently and verified only subreddit order post you need verify first how well this verification guidelines will talk through you have any questions feel free reach out via modmail your post will now automatically removed bot and this action was performed automatically please contact the moderators this subredditmessagecomposetormisogynygonewild you have any questions concerns","1","0.79807448387146"
"gamefreak nintendo the pokmon company have complicated relationship put lightly general game development with large organizations can quite obscure whose fault for what and whose hands are bound nintendo its affiliates seem simultaneously get shit too much whilst also have some the shitty things done defended when pretty much any other company did people would lot more noticeably arms general the idolization devaluation individual people symbols everything goodbad with gameproducerdevelopmentbrandwhatever seems bit out hand","2","0.4341108500957489"
"hadnt eaten anything about days was prepping much could and also just forgot eat ngl think just too low dose for sucks because was suggesting dose with least but can understand probably was just already kinda out from the and and anything crazy did happen definitely was not prime time for him pick the pace needed drive hospital wish had own supply for but tbh really glad ive been able keep myself bay and ive been abstaining from for about months since first tried far and have desire get any crystal myself personally def couldnt smoke use tina regularly because the heart palpitations again grateful not fan getting bitten that kinda drugbug unlike how used slamsniff like total degen however really just want experience what all the fuss about since and seem longstanding celebrities the bigayqueerchemsexscene while genuinely could care less about sex totally understand the appeal feeling stimmed little dissociated and also enjoying that tipsyplayful lightheartedness the combos often inspire soul considering just meeting sometime maybe next week couple months idk how busy either are going but know cant fucking around too hard since school still kicking ass appreciate your input and ngl was thinking starting for this upcoming gsesh since genuinely think could just that the batch relatively lower potency but also potentially metabolizing factormaybe its because have little bit more fat although not overweight ive started running days week again recently hoping maybe can shed some more pounds stay off drinking any alcohol for couple more months help boost that metabolism plan report here once able meet with him and try out decently naughty dose and youll still here ill glad tell about the experience all the nitty gritty details youre willing sift your eyeballs through relieved hope youre having great day and hope you have good night anyways","2","0.47634899616241455"
"there this automated message remind you please include geographic location for any requests per the community rulesrinsectsaboutrules the sub there are well over million different species bugs the world and narrowing down bugs location will help iders help you more quickly and correctly youve already included geographical location this post not request please ignore this comment thank you bot and this action was performed automatically please contact the moderators this subredditmessagecomposetorinsects you have any questions concerns","1","0.42169052362442017"
"welcome rjerkoffchat stay safe dont share personal info use anonymousencrypted accounts avoid facetattoosidentifiers set boundaries and stop pressured helpful links browse create safe sexting bot set private bot for safer anonymous sexting stopsextortioncom guidance and resources youre threatened blackmailed related subs rgoonedmeetup rsnapchatbuds rjerkinginstruction rjerkoffoncam please follow all rules and local laws note these resources are shared users cant independently verify every link bot and this action was performed automatically please contact the moderators this subredditmessagecomposetorjerkoffchat you have any questions concerns","1","0.8043125867843628"
"derby teams learn skate courses are usually aimed adults theres probably not going any kids there they will also train you from how skate forwards right how hit people stages you become ready you dont need prior training think you need know that least country roller derby majority middle aged women their who have children ive made some great friends every league ive been that are way older than started when was youll definitely still make friends but dont get your hopes too high for the same age bracket women theyll probably older than you get ready you can start buying gear you want but theyll have hire gear you can borrow think its much smarter idea attend training first cycle through some their hire gear offer get idea what you like even ask the more experienced players you can try their protective gear skates","2","0.1306198090314865"
"read the updated rules proof payout with watermark should included you are someone who gives review tasks delete this post and message the mods get verified not wait for the mods message you your post will removed and you will permanently banned karma farming strongly discourage wasting other peoples time and effort bot and this action was performed automatically please contact the moderators this subredditmessagecomposetorbeermoneyph you have any questions concerns","1","0.6438764929771423"
"gnn sonunda herey bir lkenin iindeki siyasi kapitalde bitiyor trkiyenin iinde yeterince taban destei olsa trkiye nce kandile milyon asker zaiyata kayplara ilikilerde kacak sorunlara bakmadan pkk lider kadrosunu bitirebilirdi ama veveya siyaseten siyasal olarak pahal bir opsiyon olaca iin olmad eyll sonras abdde iid gibi oluumlar bitirmek iin veya iran keye sktrmak iin bakann siyasi kapitali var ama mesela irana bir kara harekat yapp iranda kalmak zere bir igal plan iin kapital yok bunu yapan bakann partisi hezimete urar","0","0.3290042579174042"
"but hex really why him and not her just doesnt make any sense all its like idk why redeem certified evil sorcerer over his sympathetic niece kind liked charm the original series and wasnt bad but seems made girl dirty because","2","0.3708541989326477"
"uraleighh thanks for posting rdirtychatpals unfortunately your submission was removed because you are only allowed posts within hour period your lastest post ohgv utc exceeded this limit can post again hours time the time utc remember each post past this limit restarts your timer and will make longer for you wait until you can post not spam the sub what does utc mean for your posts utc coordinated universal time the standard time zone used for moderation you may need convert your local time determine when you can post again websites like timeanddatecom can help you with this not message the mod team about this these rules are applied automatically and consistently all users not make exceptions hall pass posts continued violations may result ban flooding the subreddit disrupts the community for more information see our faq thank you for understanding and contributing responsibly","1","0.6479907035827637"
"mamdani actually have plan outlined partnership with the fans where they get vote every signing and move cuomo dolan great guy the rangers are the best the league sliwa when was shot five times the back taxicab the gambino crime family","2","0.3546507656574249"
"thank you much for your post check out these other subs and and join the fun tops rboobiesandbongs ganja and titties rcompetitivetits new winner every week rgetyatitsout flashing exhibition nip slips rthedarknipple for the dark nipple lovers tails rallrearview the view from behind ranyinnies pussies buttholes and nipples rballoonknots butthole appreciation rinvitingholes welcoming holes rshirtclamming female shirtcocking fetishy rcurvyqts thick chick appreciation rfeeturednudes nudes featuring feet rpalebeach pale chicks the beach you help these subs grow with everything you its appreciated bot and this action was performed automatically please contact the moderators this subredditmessagecomposetorinvitingholes you have any questions concerns","1","0.690554141998291"
"the last government shut downs democrats argued clean was all they were asking for while republicans wanted additional policy concessions whats different this time healthcare how many people does the democratic ask effect people the amount people hurt the lost snap hurt people","2","0.2562374770641327"
"uparticularad your post has been removed because you posted something with nsfw tag please keep all content posting sfw safe for work art only nsfw posts are autoremoved our moderation automation bots longer allow nsfw art rhoustonlesbian you think this mistake please contact the moderators through modmail thank you","1","0.5945826768875122"
"whatever happens tomorrow everyone will okay amazon hires top talent and everyone knows previous employee having amazon experience your resume attracts recruiters keep mind mass layoffs have nothing with your talent you were hired because you are the best and you will the best the next place you","2","0.2361394464969635"
"hindi oaginagaslight sarili bakit nagpapakaanak mga magulang hindi naman tinuring anak hindi nagpakamagulang sayo unahin sarili yung anak pinabayaan nga nila matanda yan mga yan sila kailangan akuin inaabuso nagpapaabuso naman","0","0.25331881642341614"
"the story goes like this was born amstetten lower austria april josef fritzl was found guilty one the most horrifying incidents rape false imprisonment and incest modern history when elisabeth was eleven years old started sexually abusing her under the guise assisting with the installation door fritzl lured her into the basement their family house then sedated her with ethersoaked rag and locked her soundproofed crypt had covertly built over number years the ceiling was just had she and her kids had endure that for years with natural light forced her have seven children with him held her captive for years saed her frequently sometimes many times day the mental trauma she and her three kids undergroundhad was really bad till this day she cant seem get over even the kids that were taken raised josef himself remaining three even had anger management after the whole truth came out","0","0.27455300092697144"
"when left christianity found that despite being told all life that people had godshaped hole that they needed fill with jesus been trying cram jesus into hole that didnt exist but the difference case was that left primarily because didnt believe rather than because didnt like although certainly didnt see god loving before the end wasnt looking for anything fill hole left the lack christianity because there was hole lot people though leave christianity for other reasons than and out search something give them the same feeling purpose community hope etc that christianity was supposed give them many find other religions that fit them better this the sort situation youre now are you seeking the things that christianity failed provide","2","0.28416502475738525"
"you and just keep making excuses for being selfish and making strawman arguments one ever said nobody said the best contribution you believe you have offer society procreation though sadly that really might the best you yourself can shoot for considering how adverse you are any responsibility advocate for because most people are capable being good parents and having kids changes you for the better done this for literally thousands years but now this time abundance its some how too hard like just stahp the rest will the hard work get also saying procreating base level instinct minor achievement disconnected and bizarre from being base level healthy minded human that blows mind ive worked fighter jets ran companies worked with people who make literally hundreds million dollars cant fathom what the world you believe major human achievement other then creating exceptional human being that will change the world hahaha you sir lack wisdom","2","0.28489476442337036"
"need patience hahaha one cat lang ung pinakapon pero grabe ung stress naexp hahahaha thankful ako kapatid kasi tinutulungan nya alagaan ung pusa magpapainom meds apply cream alalay pagihi inom pagbabantay kung nadidilaan ung sugat very important ung cone marami kaming cone binili kasi natatanggal nya talaga hanggang nahanap namin ung best cone hahahaha tapos nagsuggest din sila tofu litter ung gamitin nila para magpoop ihi late namin nalaman pero buti lang din dinidikit pusa ung butt nya sand nainfect sugat nya usually week lang recovery period male cats daw pero umabot two weeks just make sure dry ung sugat sobrang maaawa kanila kasi umiiyak sila pag sanay cone nakakapaggroom tho binibigyan namin break cone para makapaggroom tapos binabalik namin pag didilaan ung sugat mas magandang nakacage sila para minimal movements maliit kwarto sila makakatalon ayon since two cats yan much better may kasama tutulong sayo","0","0.3125970959663391"
